comments,disposition,incident,location,occurred,predicted_incident,reported,reported_date,season,ucpd_id,validated_address,validated_location
Credit cards taken from wallet in unsecured locker / Unauthorized use of credit cards reported,Open,Theft,5530 S. Ellis Ave. (Ratner A.C.),11/13/25 2:00 PM to 3:00 PM,,2025-11-13 17:55:00-06:00,2025-11-13,Fall,25-01524,"5530 S Ellis Ave, Chicago, Il, 60637",[ 41.79444356 -87.60144801]
Three unknown subjects used deception to use victim's phone off-campus to access funds from victim's bank account / Referred to CPD,Referred,Information / Deceptive Practice,5427 S. University Ave. (Public Way),11/13/25 3:30 PM,,2025-11-13 16:23:00-06:00,2025-11-13,Fall,2025-062628,"5427 S University Ave, Chicago, Il, 60615",[ 41.79719297 -87.59805036]
"Wallet taken from unattended, unsecured backpack in unsecured office / Unauthorized use of credit cards reported",Open,Theft,929 E. 57th St. (Gordon Center),11/13/25 12:40 PM to 1:50 PM,,2025-11-13 14:43:00-06:00,2025-11-13,Fall,25-01523,"929 E 57th St, Chicago, Il, 60637",[ 41.79131786 -87.6030103 ]
Secured electric scooter taken from bike rack,Open,Theft,6031 S. Ellis Ave. (Granville-Grossman RH Bike Rack),11/11/25 to 11/13/25 2:00 PM to 12:00 PM,,2025-11-13 14:02:00-06:00,2025-11-13,Fall,25-01522,"6031 S Ellis Ave, Chicago, Il, 60637",[ 41.78535247 -87.60110174]
Unknown subjects took a catalytic converter from a vehicle parked on the street off-campus / Referred to CPD,Referred,Information / Theft from Motor Vehicle,1401 E. 56th St. (Public Way),11/13/25 6:44 AM,,2025-11-13 06:45:00-06:00,2025-11-13,Fall,2025-062561,"1401 E 56th St, Chicago, Il, 60637",[ 41.79327086 -87.59156242]
Bicycle found on the street was inventoried at UCPD for safekeeping,Closed,Found Property,1414 E. 59th St. (Public Way),11/12/25 11:39 PM,,2025-11-12 23:41:00-06:00,2025-11-12,Fall,25-01521,"1414 E 59th St, Chicago, Il, 60637",[ 41.78791518 -87.59109314]
Three unknown subjects used deception to use victim's cell phone to take cash from victim's bank account / CPD case JJ487091,CPD,Information / Deceptive Practice,5300 S. Greenwood Ave. (Public Way),11/12/25 5:10 PM,,2025-11-12 21:22:00-06:00,2025-11-12,Fall,2025-062408,"5300 S Greenwood Ave, Chicago, Il, 60615",[ 41.79936322 -87.59981525]
A key fob was found on UC Shuttle Bus and turned over to UCPD for safekeeping,Closed,Found Property,850 E. 61st St. (UCPD HQ),11/12/25 5:50 PM,,2025-11-12 20:14:00-06:00,2025-11-12,Fall,25-01520,"850 E 61st St, Chicago, Il, 60637",[ 41.78412446 -87.60566276]
A patient making verbal threats to UCM staff was documented,Closed,Information,5656 S. Maryland Ave. (UCMED),11/12/25 11:10 AM to 7:05 PM,Aggravated Assault of a Police Officer,2025-11-12 19:21:00-06:00,2025-11-12,Fall,25-01518,"5656 S Maryland Ave, Chicago, Il, 60637",[ 41.7921342  -87.60503297]
Three unknown subjects used deception to use victim's debit card to take cash from victim's bank account,Open,Deceptive Practice / Confidence Game,5600 S. Woodlawn Ave. (Public Way),11/12/25 4:50 PM,,2025-11-12 19:21:00-06:00,2025-11-12,Fall,25-01519,"5600 S Woodlawn Ave, Chicago, Il, 60637",[ 41.79320681 -87.59657467]
"Wallet taken from unsecured, unattended wallet left in unsecured office",Open,Theft,5815 S. Maryland Ave. (Mitchell Hospital),11/12/25 2:20 PM to 3:45 PM,,2025-11-12 15:58:00-06:00,2025-11-12,Fall,25-01517,"5815 S Maryland Ave, Chicago, Il, 60637",[ 41.78922352 -87.60487504]
A mental health patient restrained by staff,Closed,Information,5656 S. Maryland Ave. (UCMED),11/12/25 11:00 AM,,2025-11-12 11:18:00-06:00,2025-11-12,Fall,25-01516,"5656 S Maryland Ave, Chicago, Il, 60637",[ 41.7921342  -87.60503297]
Window smashed and property taken from a vehicle parked on the street off-campus,Open,Theft,5309 S. Kimbark Ave. (Public Way),11/11/25 to 11/12/25 8:00 PM to 5:15 AM,,2025-11-12 05:32:00-06:00,2025-11-12,Fall,25-01515,"5309 S Kimbark Ave, Chicago, Il, 60615",[ 41.79917041 -87.59494177]
A subject took merchandise from the off-campus store without paying / Suspect located and arrested by UCPD officers,Arrest,Theft,1554 E. 55th St. (Walgreens),11/11/25 5:08 PM,,2025-11-11 17:08:00-06:00,2025-11-11,Fall,25-01514,"1554 W 55th St, Chicago, Il, 60609",[ 41.79409491 -87.66382574]
An unknown subject took merchandise from the off-campus store without paying / Referred to CPD,Referred,Information / Theft,1554 E. 55th St. (Walgreens),11/11/25 4:40 PM,,2025-11-11 16:40:00-06:00,2025-11-11,Fall,2025-062128,"1554 W 55th St, Chicago, Il, 60609",[ 41.79409491 -87.66382574]
An unknown subject took merchandise from the off-campus store without paying / Referred to CPD,Referred,Information / Theft,1554 E. 55th St. (Walgreens),11/11/25 3:30 PM,,2025-11-11 15:32:00-06:00,2025-11-11,Fall,2025-062118,"1554 W 55th St, Chicago, Il, 60609",[ 41.79409491 -87.66382574]
An unknown subject took merchandise from the off-campus store without paying / Referred to CPD,Referred,Information / Theft,1554 E. 55th St. (Walgreens),11/11/25 1:23 PM,,2025-11-11 13:23:00-06:00,2025-11-11,Fall,2025-062098,"1554 W 55th St, Chicago, Il, 60609",[ 41.79409491 -87.66382574]
Delayed report of a pedestrian striking the side of a vehicle / No damage reported,Open,Disorderly Conduct,5700 S. Maryland Ave. (Street),11/10/25 7:20 AM,,2025-11-11 07:47:00-06:00,2025-11-11,Fall,25-01513,"5700 S Maryland Ave, Chicago, Il, 60637",[ 41.7903992  -87.60501721]
Two unknown subjects snatched victim's phone from a bicycle while victim was in a store / CPD case JJ484807,CPD,Information / Theft,1400 E. 47th St. (Parking Lot),11/10/25 8:50 PM,,2025-11-10 20:53:00-06:00,2025-11-10,Fall,2025-061932,"1400 E 47th St, Chicago, Il, 60653",[ 41.80974745 -87.5923544 ]
A parked vehicle was struck by another vehicle that fled the scene,Open,Traffic Crash / Property Damage / Hit and Run,5513 S. Kimbark Ave. (Public Way),11/7/25 to11/10/25 12:00 PM to 8:10 PM,,2025-11-10 20:15:00-06:00,2025-11-10,Fall,25-01512,"5513 S Kimbark Ave, Chicago, Il, 60637",[ 41.79453734 -87.59483353]
Apple AirPods found in Ride Smart vehicle turned over to UCPD for safekeeping,Closed,Found Property,850 E. 61st St. (UCPD HQ),11/10/25 4:55 PM,,2025-11-10 16:58:00-06:00,2025-11-10,Fall,25-01511,"850 E 61st St, Chicago, Il, 60637",[ 41.78412446 -87.60566276]
A conversation between a UCM staff member and a mental health patient was documented,Closed,Information,5656 S. Maryland Ave. (UCMED),11/10/25 12:30 PM,Aggravated Fleeing Police,2025-11-10 12:35:00-06:00,2025-11-10,Fall,25-01510,"5656 S Maryland Ave, Chicago, Il, 60637",[ 41.7921342  -87.60503297]
A van parked on the street was struck by another vehicle that fled the scene,Open,Traffic Crash / Property Damage / Hit and Run,5848 S. Harper Ave. (Public Way),11/7/25 to 11/10/25 2:30 PM to 9:50 AM,,2025-11-10 09:56:00-06:00,2025-11-10,Fall,25-01509,"5848 S Harper Ave, Chicago, Il, 60637",[ 41.78882208 -87.58904762]
An unauthorized person was questioned regarding his presence in the residence hall lobby / Subject warned of trespass,Closed,Information,1156 E. 61st St. (WRC),11/10/25 9:15 AM,Damage to Vehicle,2025-11-10 09:26:00-06:00,2025-11-10,Fall,25-01508,"1156 E 61st St, Chicago, Il, 60637",[ 41.78420791 -87.5974474 ]
An unknown subject took merchandise from the off-campus store without paying / Referred to CPD,Referred,Information / Theft,1554 E. 55th St. (Walgreens),11/10/25 8:45 AM,,2025-11-10 08:46:00-06:00,2025-11-10,Fall,2025-061812,"1554 W 55th St, Chicago, Il, 60609",[ 41.79409491 -87.66382574]
An unknown subject took merchandise from the off-campus store without paying / Referred to CPD,Referred,Information / Theft,1554 E. 55th St. (Walgreens),11/10/25 8:20 AM,,2025-11-10 08:24:00-06:00,2025-11-10,Fall,2025-061807,"1554 W 55th St, Chicago, Il, 60609",[ 41.79409491 -87.66382574]
A wallet was found in a rideshare vehicle and turned over to UCPD for safekeeping,Closed,Found Property,850 E. 61st St. (UCPD HQ),11/10/25 2:54 AM,,2025-11-10 02:54:00-06:00,2025-11-10,Fall,25-01507,"850 E 61st St, Chicago, Il, 60637",[ 41.78412446 -87.60566276]
A patient in need of mental health evaluation was restrained and treated,Closed,Information,5656 S. Maryland Ave. (UCMED),11/9/25 1:56 PM,,2025-11-09 13:56:00-06:00,2025-11-09,Fall,25-01505,"5656 S Maryland Ave, Chicago, Il, 60637",[ 41.7921342  -87.60503297]
An unknown subject took merchandise from the off-campus store without paying / Referred to CPD,Referred,Information / Theft,1554 E. 55th St. (Walgreens),11/9/25 11:37 AM,,2025-11-09 11:38:00-06:00,2025-11-09,Fall,2025-061596,"1554 W 55th St, Chicago, Il, 60609",[ 41.79409491 -87.66382574]
"A patient, fully licensed to own and carry a firearm, had weapon in their possession / Weapon turned over to UCPD for safekeeping",Closed,Found Property,5656 S. Maryland Ave. (UCMED),11/9/25 8:30 AM,,2025-11-09 08:32:00-06:00,2025-11-09,Fall,25-01503,"5656 S Maryland Ave, Chicago, Il, 60637",[ 41.7921342  -87.60503297]
"Two unknown suspects, armed with handguns, took property from two victims walking on the sidewalk off-campus before fleeing to a waiting vehicle / CPD case JJ482840",CPD,Information / Armed Robbery,5039 S. Blackstone Ave. (Public Way),11/9/25 3:55 AM,,2025-11-09 04:06:00-06:00,2025-11-09,Fall,2025-061541,"5039 S Blackstone Ave, Chicago, Il, 60615",[ 41.80353707 -87.59044965]
"Four unknown suspects, armed with handguns, took property from a person walking in an alley off-campus / CPD case JJ482634",CPD,Information / Armed Robbery,4830 S. Drexel Ave. (Alley),11/8/25 9:45 PM,,2025-11-08 21:51:00-06:00,2025-11-08,Fall,2025-061443,"4830 S Drexel Blvd, Chicago, Il, 60615",[ 41.80715755 -87.60439714]
Funds taken from complainant's bank account,Open,Theft,5525 S. Ellis Ave. (Maroon Financial),11/4/25 to 11/7/25 3:15 PM to 4:00 PM,,2025-11-08 16:05:00-06:00,2025-11-08,Fall,25-01502,"5525 S Ellis Ave, Chicago, Il, 60637",[ 41.7941822  -87.60128794]
Secured electric bicycle taken from bike rack,Open,Theft,1100 E. 57th St. (Regenstein Bike Rack),11/8/25 9:00 AM to 1:00 PM,,2025-11-08 13:23:00-06:00,2025-11-08,Fall,25-01501,"1100 E 57th St, Chicago, Il, 60637",[ 41.79148537 -87.59815254]
A catalytic converter was taken from a vehicle parked on the street off-campus / Referred to CPD,Referred,Information / Theft from Motor Vehicle,5540 S. Hyde Park Blvd. (Public Way),11/7/25 to 11/8/25 9:00 PM to 9:30 AM,,2025-11-08 09:53:00-06:00,2025-11-08,Fall,2025-061317,"5540 S Hyde Park Blvd, Chicago, Il, 60637",[ 41.79415169 -87.58400152]
A suspect displayed a knife and threatened another person with bodily harm / Suspect located and arrested by UCPD officers,Arrest,Aggravated Assault,1228 E. 53rd St. (Parking Lot),11/7/25 11:29 PM,,2025-11-07 23:30:00-06:00,2025-11-07,Fall,25-01499,"1228 E 53rd St, Chicago, Il, 60615",[ 41.79951603 -87.59614964]
Laptop left unattended and unsecured in locker room was taken by unknown person,Open,Theft,5700 S. Maryland Ave. (CCD),11/4/25 to 11/7/25 3:30 PM to 12:30 AM,,2025-11-07 16:42:00-06:00,2025-11-07,Fall,25-01496,"5700 S Maryland Ave, Chicago, Il, 60637",[ 41.7903992  -87.60501721]
An unauthorized individual was cautioned regarding trespass and was escorted from the building,Closed,Trespass Warning,1150 E. 58th St. (Saieh Hall),11/7/25 3:33 PM,,2025-11-07 15:34:00-06:00,2025-11-07,Fall,25-01494,"1150 E 58th St, Chicago, Il, 60637",[ 41.78967746 -87.59681877]
A physical altercation between two individuals occurred off-campus / Charter school administrators to handle discipline,Closed,Battery,6301 S. University Ave. (Public Way),11/7/25 3:10 PM,,2025-11-07 15:16:00-06:00,2025-11-07,Fall,25-01493,"6301 S University Ave, Chicago, Il, 60637",[ 41.77951887 -87.59715594]
A person reported that three cashier's checks were stolen from the U.S. Mail and altered by an unknown suspect / Victim referred to CPD,Referred,Information / Theft,850 E. 61st St. (UCPD HQ),10/24/25 unknown time,,2025-11-07 15:11:00-06:00,2025-11-07,Fall,2025-061097,"850 E 61st St, Chicago, Il, 60637",[ 41.78412446 -87.60566276]
A discussion between patient and staff member documented,Closed,Information,5758 S. Maryland Ave. (DCAM),11/7/25 1:16 PM,Aggravated Fleeing Police,2025-11-07 13:17:00-06:00,2025-11-07,Fall,25-01492,"5758 S Maryland Ave, Chicago, Il, 60637",[ 41.79005688 -87.60501186]
Basement door damaged by unknown person(s),Open,Damage to Property,6031 S. Ellis Ave. (Granville-Grossman RH),11/5/25 to 11/6/25 9:00 AM to 8:00 AM,,2025-11-07 10:02:00-06:00,2025-11-07,Fall,25-01491,"6031 S Ellis Ave, Chicago, Il, 60637",[ 41.78535247 -87.60110174]
Unknown subjects smashed the window of a van parked on the street off-campus / CPD case,CPD,Information / Criminal Damage to Vehicle,1716 E. 53rd St. (Public Way),11/7/25 1:55 AM,,2025-11-07 01:57:00-06:00,2025-11-07,Fall,2025-061017,"1716 E 53rd St, Chicago, Il, 60615",[ 41.79969445 -87.58323691]
Unknown person(s) discharged a firearm striking the window of an unoccupied parked vehicle / CPD case JJ480388,CPD,Information / Shot Fired / Damage to Property,5500 S. Shore Dr. (Public Way),11/7/25 1:15 AM,,2025-11-07 01:16:00-06:00,2025-11-07,Fall,2025-061010,"5500 S Shore Dr, Chicago, Il, 60637",[ 41.79522288 -87.58052778]
Three unknown subjects took merchandise from the off-campus store without paying / Referred to CPD,Referred,Information / Theft,1554 E. 55th St. (Walgreens),11/6/25 11:38 PM,,2025-11-06 23:39:00-06:00,2025-11-06,Fall,2025-060993,"1554 W 55th St, Chicago, Il, 60609",[ 41.79409491 -87.66382574]
Vehicle struck two parked vehicles and other property on the street off-campus / Driver transported to UCMED by CFD EMS,Open,Traffic Crash / Property Damage,4937 S. Kimbark Ave. (Public Way),11/6/25 7:29 PM,,2025-11-06 19:30:00-06:00,2025-11-06,Fall,25-01490,"4937 S Kimbark Ave, Chicago, Il, 60615",[ 41.80533553 -87.59506917]
Property found on a UC Shuttle Bus turned over to UCPD for safekeeping,Closed,Found Property,850 E. 61st St. (UCPD HQ),11/6/25 12:00 PM,,2025-11-06 16:41:00-06:00,2025-11-06,Fall,25-01489,"850 E 61st St, Chicago, Il, 60637",[ 41.78412446 -87.60566276]
A person in need of medical attention was transported to UCMED by CFD EMS,Closed,Medical Call,5706 S. University Ave. (Reynolds Club),11/6/25 4:02 PM,,2025-11-06 16:02:00-06:00,2025-11-06,Fall,25-01488,"5706 S University Ave, Chicago, Il, 60637",[ 41.79126654 -87.59814716]
Argument between two staff members documented,Open,Assault,5700 S. Maryland Ave. (CCD),11/3/25 11:30 AM,,2025-11-06 13:25:00-06:00,2025-11-06,Fall,25-01487,"5700 S Maryland Ave, Chicago, Il, 60637",[ 41.7903992  -87.60501721]
Suspicious activity documented,Closed,Information,1155 E. 58th St. (ISAC),11/6/25 8:40 AM,,2025-11-06 10:23:00-06:00,2025-11-06,Fall,25-01486,"1155 E 58th St, Chicago, Il, 60637",[ 41.78955386 -87.59781625]
Window shattered in work van parked on the street off-campus / Referred to CPD,Referred,Information / Criminal Damage to Vehicle,5553 S. Blackstone Ave. (Public Way),11/6/25 8:30 AM to 10:00 AM,,2025-11-06 10:13:00-06:00,2025-11-06,Fall,2025-060870,"5553 S Blackstone Ave, Chicago, Il, 60637",[ 41.79402595 -87.59023407]
"DSS was notified by a Campus Security Authority that an undisclosed victim reported she was sexually assaulted by an acquaintance / Due to confidentiality of reporting, limited information is available regarding this incident",No Investigation Referred to Title IX Coordinator,Sexual Assault,1009 E. 57th St. (Snell-Hitchcock RH),11/1/25 time not specified,,2025-11-06 09:44:00-06:00,2025-11-06,Fall,CSA Report 25-001,"1009 E 57th St, Chicago, Il, 60637",[ 41.79133942 -87.60104438]
"Delayed report - theft of credit/debit cards from unattended, unsecured wallet / Subsequent unauthorized use of cards reported",Open,Theft,929 E. 57th St. (Gordon Center),10/23/25 3:30 PM to 3:40 PM,,2025-11-06 09:25:00-06:00,2025-11-06,Fall,25-01485,"929 E 57th St, Chicago, Il, 60637",[ 41.79131786 -87.6030103 ]
A person was transported to UCMED for evaluation,Closed,Medical Transport,5625 S. Ellis Ave. (Max Palevsky RC),11/6/25 8:49 AM,,2025-11-06 08:49:00-06:00,2025-11-06,Fall,25-01484,"5625 S Ellis Ave, Chicago, Il, 60637",[ 41.79273766 -87.60125727]
"UCPD officer recovered an unoccupied, abandoned vehicle that had been reported stolen to another agency",Closed,Recovered Vehicle,5900 S. Stony Island Ave. (Public Way),11/6/25 12:54 AM,,2025-11-06 00:59:00-06:00,2025-11-06,Fall,25-01481,"5900 S Stony Island Ave, Chicago, Il, 60637",[ 41.78633061 -87.58667573]
Delayed report of vehicle vs. bicycle crash,Closed,Traffic Crash / Personal Injury,5500 S. University Ave. (Public Way),11/5/25 9:30 PM,,2025-11-06 00:48:00-06:00,2025-11-06,Fall,25-01482,"5500 S University Ave, Chicago, Il, 60637",[ 41.79501825 -87.5981983 ]
Vehicle parked on the street struck by another vehicle that fled the scene,Open,Traffic Crash / Property Damage / Hit and Run,951 E. 61st St. (Public Way),11/5/25 8:30 AM to 9:00 PM,,2025-11-05 22:18:00-06:00,2025-11-05,Fall,25-01483,"951 E 61st St, Chicago, Il, 60637",[ 41.78403838 -87.60236081]
A person in need of medical attention was transported to UCMED by CFD EMS,Closed,Medical Call,6031 S. Ellis Ave. (Granville-Grossman RH),11/5/25 9:07 PM,,2025-11-05 21:07:00-06:00,2025-11-05,Fall,25-01480,"6031 S Ellis Ave, Chicago, Il, 60637",[ 41.78535247 -87.60110174]
"Two suspects, one armed with a metal club, took property from two people walking on the sidewalk off-campus / CPD case JJ479030",CPD,Information / Armed Robbery,4749 S. Drexel Ave. (Public Way),11/5/25 8:10 PM,,2025-11-05 20:14:00-06:00,2025-11-05,Fall,2025-060731,"4749 S Drexel Blvd, Chicago, Il, 60615",[ 41.80849891 -87.60379694]
A found ID card was turned over to UCPD / Owner notified,Closed,Found Property,850 E. 61st St. (UCPD HQ),11/5/2/5 4:30 PM,,2025-11-05 17:32:00-06:00,2025-11-05,Fall,25-01479,"850 E 61st St, Chicago, Il, 60637",[ 41.78412446 -87.60566276]
Unknown subject damaged a Quran in the hospital chapel by writing hateful messages in the book,Open,Damage to Property,5700 S. Maryland Ave. (CCD Chapel),10/11/25 5:30 PM,,2025-11-05 16:19:00-06:00,2025-11-05,Fall,25-01478,"5700 S Maryland Ave, Chicago, Il, 60637",[ 41.7903992  -87.60501721]
Secured bicycle taken from bike rack,Open,Theft,6031 S. Ellis Ave. (Granville-Grossman RH Bike Rack),11/4/25 to 11/5/25 8:00 PM to 1:25 PM,,2025-11-05 14:52:00-06:00,2025-11-05,Fall,25-01477,"6031 S Ellis Ave, Chicago, Il, 60637",[ 41.78535247 -87.60110174]
Water tank on food truck damaged when struck by a scooter,Closed,Non-Criminal Damage to Property,5807 S. Ellis Ave. (Public Way),11/5/25 1:34 PM,,2025-11-05 13:34:00-06:00,2025-11-05,Fall,25-01476,"5807 S Ellis Ave, Chicago, Il, 60637",[ 41.78944651 -87.60118196]
A subject was taken into custody for threatening to start a fire in the building,Arrest,Disorderly Conduct,1100 E. 57th St. (Mansueto Library),11/5/25 9:50 AM,,2025-11-05 09:53:00-06:00,2025-11-05,Fall,25-01474,"1100 E 57th St, Chicago, Il, 60637",[ 41.79148537 -87.59815254]
A vehicle struck a rail in the parking structure causing minor damage,Closed,Non-Criminal Damage to Property,5505 S. Ellis Ave. (Parking Structure),11/5/25 9:36 AM,,2025-11-05 09:38:00-06:00,2025-11-05,Fall,25-01475,"5505 S Ellis Ave, Chicago, Il, 60637",[ 41.79483054 -87.60129259]
An unknown subject threatened to use pepper spray on UCM staff members / Suspect fled the scene,Open,Assault,5758 S. Maryland Ave. (DCAM),11/5/25 6:40 AM,,2025-11-05 06:42:00-06:00,2025-11-05,Fall,25-01473,"5758 S Maryland Ave, Chicago, Il, 60637",[ 41.79005688 -87.60501186]
A n unknown subject smashed the window of a vehicle parked on the street off-campus and took property / Referred to CPD,Referred,Information / Theft,1645 E. 53rd St. (Public Way),11/5/25 6:03 AM,,2025-11-05 06:03:00-06:00,2025-11-05,Fall,25-01472,"1645 E 53rd St, Chicago, Il, 60615",[ 41.79953502 -87.58520832]
A bracelet was found by a rideshare driver and turned over to UCPD for safekeeping,Closed,Found Property,850 E. 61st St. (UCPD HQ),11/4/25 7:20 PM,,2025-11-05 00:26:00-06:00,2025-11-05,Fall,25-01471,"850 E 61st St, Chicago, Il, 60637",[ 41.78412446 -87.60566276]
Unknown subject damaged a Quran in the hospital chapel by writing hateful anti-religious messages in ink,Open,Damage to Property,5815 S. Maryland Ave. (Mitchell Hospital),11/4/25 2:29 PM,,2025-11-04 14:29:00-06:00,2025-11-04,Fall,25-01470,"5815 S Maryland Ave, Chicago, Il, 60637",[ 41.78922352 -87.60487504]
A known acquaintance took victim's vehicle parked on the street off-campus without consent / Referred to CPD,Referred,Information / Motor Vehicle Theft,1513 E. 53rd St. St (Public Way),11/4/25 12:30 PM,,2025-11-04 12:57:00-06:00,2025-11-04,Fall,2025-060338,"1513 E 53rd St, Chicago, Il, 60615",[ 41.79949107 -87.58865477]
A fire alarm was activated due to smoke from an elevator malfunction / CFD responded / No fire or injuries reported,Closed,Information / Fire Alarm,840 E. 59th St. (Student Wellness),11/4/25 12:05 PM,,2025-11-04 12:05:00-06:00,2025-11-04,Fall,25-01469,"840 E 59th St, Chicago, Il, 60637",[ 41.78777742 -87.60410742]
Unknown subject smashed window in parked vehicle off-campus and took property / Referred to CPD,Referred,Information / Theft,5443 S. Shore Dr. (Public Way),11/3/25 to 11/4/25 6:00 PM to 6:20 AM,,2025-11-04 06:57:00-06:00,2025-11-04,Fall,2025-060269,"5443 S Shore Dr, Chicago, Il, 60615",[ 41.79860855 -87.58221894]
A subject that had been previously warned about trespass ignored warning / Management declined prosecution,Ex. Cleared,Trespass to Property,1554 E. 55th St. (Walgreens),11/4/25 1:23 AM,,2025-11-04 01:23:00-06:00,2025-11-04,Fall,25-01468,"1554 W 55th St, Chicago, Il, 60609",[ 41.79409491 -87.66382574]
Person reported they lost headphones in the building,Closed,Lost Property,1414 E. 59th St. (I-House),10/28/25 to 11/2/25 9:00 PM to 2:20 PM,,2025-11-03 20:34:00-06:00,2025-11-03,Fall,25-01467,"1414 E 59th St, Chicago, Il, 60637",[ 41.78791518 -87.59109314]
A person standing on the sidewalk was struck with a paintball fired by a person that fled in a waiting vehicle,Open,Battery,6100 S. Ellis Ave. (Public Way),11/3/25 7:48 PM,,2025-11-03 19:48:00-06:00,2025-11-03,Fall,25-01466,"6100 S Ellis Ave, Chicago, Il, 60637",[ 41.78405383 -87.6012232 ]
A person walking on the sidewalk off-campus was struck with a paintball fired from a passing vehicle,Open,Battery,5750 S. Stony Island Ave. (Public Way),11/3/25 6:10 PM,,2025-11-03 18:25:00-06:00,2025-11-03,Fall,25-01464,"5750 S Stony Island Ave, Chicago, Il, 60637",[ 41.7903893  -87.58676583]
A person previously banned from UC property was arrested for trespass,Arrest,Trespass to Property,915 E. 60th St.(Shuttle Bus),11/3/25 6:04 PM,,2025-11-03 18:15:00-06:00,2025-11-03,Fall,25-01465,"915 E 60th St, Chicago, Il, 60637",[ 41.78583956 -87.60381135]
Secured electric scooter taken from bike rack,Open,Theft,1100 E. 57th St. (Regenstein Library Bike Rack),11/3/25 2:00 PM to 3:20 PM,,2025-11-03 15:36:00-06:00,2025-11-03,Fall,25-01463,"1100 E 57th St, Chicago, Il, 60637",[ 41.79148537 -87.59815254]
A person was transported to UCMED for evaluation,Closed,Medical Transport,840 E. 59th St. (Student Wellness),11/3/25 3:06 PM,,2025-11-03 15:10:00-06:00,2025-11-03,Fall,25-01462,"840 E 59th St, Chicago, Il, 60637",[ 41.78777742 -87.60410742]
Cell phone found and turned over to UCPD for safekeeping / Owner notified,Closed,Found Property,850 E. 61st St. (UCPD HQ),11/3/25 8:54 AM,,2025-11-03 14:23:00-06:00,2025-11-03,Fall,25-01461,"850 E 61st St, Chicago, Il, 60637",[ 41.78412446 -87.60566276]
A subject took merchandise from the off-campus store without paying / UCPD officer located and arrested the suspect,Arrest,Theft,1554 E. 55th St. (Walgreens),11/3/25 11:16 AM,,2025-11-03 11:18:00-06:00,2025-11-03,Fall,25-01460,"1554 W 55th St, Chicago, Il, 60609",[ 41.79409491 -87.66382574]
Unknown subject forced entry to vehicle parked on the street off-campus and took property / Referred to CPD,Referred,Information / Theft,5300 S. Drexel Ave. (Public Way),11/1/25 to 11/2/25 9:00 PM to 11:15 AM,,2025-11-02 11:23:00-06:00,2025-11-02,Fall,2025-059807,"5300 S Drexel Ave, Chicago, Il, 60615",[ 41.79858862 -87.60397692]
A person was transported to UCMED for evaluation,Closed,Medical Transport,1005 E. 60th St. (Burton-Judson RH),11/2/25 11:00 AM,,2025-11-02 11:00:00-06:00,2025-11-02,Fall,25-01459,"1005 E 60th St, Chicago, Il, 60637",[ 41.78587286 -87.60103446]
Window smashed in vehicle parked on the street off-campus / Referred to CPD,Referred,Information / Criminal Damage to Vehicle,5459 S. University Ave. (Public Way),11/2/25 9:00 AM,,2025-11-02 09:03:00-06:00,2025-11-02,Fall,2025-059787,"5459 S University Ave, Chicago, Il, 60615",[ 41.7963166  -87.59803226]
An unauthorized subject was given a warning of criminal trespass and released,Closed,Trespass to Property,1116 E. 59th St. (S. Harper Ave. Library),11/2/25 8:05 AM,,2025-11-02 08:05:00-06:00,2025-11-02,Fall,25-01458,"1116 E 59th St, Chicago, Il, 60637",[ 41.78782808 -87.59934635]
An underage individual became ill after consuming alcoholic beverages and was transported to UCMED by CFD EMS,Referred,Liquor Law Violation,1414 E. 59th St. (I-House),11/2/25 3:02 AM,,2025-11-02 03:02:00-06:00,2025-11-02,Fall,25-01457,"1414 E 59th St, Chicago, Il, 60637",[ 41.78791518 -87.59109314]
Intoxicated subject found sleeping in vehicle they believed to belong to a relative / Peace restored,Closed,Information,5311 S. Lake Park Ave. (Parking Lot),11/2/25 2:13 AM,Armed Robbery Arrest / Attempted Armed Robbery,2025-11-02 02:13:00-06:00,2025-11-02,Fall,25-01456,"5311 S Lake Park Ave, Chicago, Il, 60615",[ 41.79937322 -87.58720802]
An underage individual became ill after consuming alcoholic beverages and was transported to UCMED by CFD EMS,Referred,Liquor Law Violation,5500 S. University Ave. (Campus North RH),11/2/25 12:16 AM,,2025-11-02 00:16:00-05:00,2025-11-02,Fall,25-01455,"5500 S University Ave, Chicago, Il, 60637",[ 41.79501825 -87.5981983 ]
A person was notified they were the subject of an Order of Protection issued by the Circuit Court of Cook County,Closed,Notification of Order of Protection,6054 S. Drexel Ave. (Parking Structure),11/1/25 5:58 PM,,2025-11-01 17:58:00-05:00,2025-11-01,Fall,25-01454,"6054 S Drexel Ave, Chicago, Il, 60637",[ 41.78450123 -87.60447514]
Social media posting complaints/investigation documented,Closed,Information,1362 E. 59th St. (Lab School),10/6/25 5:25 PM,,2025-11-01 17:26:00-05:00,2025-11-01,Fall,25-01453,"1362 E 59th St, Chicago, Il, 60637",[ 41.78789688 -87.59272762]
Secured electric scooter taken from bike rack,Open,Theft,5530 S. Ellis Ave. (Ratner A.C. Bike Rack),10/30/25 3:30 PM to 7:30 PM,,2025-11-01 16:46:00-05:00,2025-11-01,Fall,25-01452,"5530 S Ellis Ave, Chicago, Il, 60637",[ 41.79444356 -87.60144801]
Information relating to a hit & run traffic crash,Closed,Information,4543 S. Greenwood Ave. (Public Way),11/1/25 2:18 PM,Attempted Aggravated Robbery / Cyberstalking,2025-11-01 14:18:00-05:00,2025-11-01,Fall,25-01451,"4543 S Greenwood Ave, Chicago, Il, 60653",[ 41.81246753 -87.59924589]
Minor Damage to UC owned vehicle documented,Closed,Non-Criminal Damage,5730 S. Ellis Ave. (Public Way),10/28/25 8:00 PM,,2025-11-01 07:15:00-05:00,2025-11-01,Fall,25-01450,"5730 S Ellis Ave, Chicago, Il, 60637",[ 41.79080003 -87.60136349]
An underage individual became ill after consuming alcoholic beverages and was transported to UCMED by CFD EMS,Referred,Liquor Law Violation,5500 S. University Ave. (Campus North RH),11/1/25 1:26 AM,,2025-11-01 01:26:00-05:00,2025-11-01,Fall,25-01449,"5500 S University Ave, Chicago, Il, 60637",[ 41.79501825 -87.5981983 ]
An underage individual became ill after consuming alcoholic beverages and was transported to UCMED by CFD EMS,Referred,Liquor Law Violation,1414 E. 59th St. (I-House),11/1/25 1:01 AM,,2025-11-01 01:01:00-05:00,2025-11-01,Fall,25-01447,"1414 E 59th St, Chicago, Il, 60637",[ 41.78791518 -87.59109314]
Patient's property taken by unknown person(s),Open,Theft,5656 S. Maryland Ave. (UCMED),10/30/25 to 11/1/25 11:20 PM to 12:00 AM,,2025-11-01 01:00:00-05:00,2025-11-01,Fall,25-01448,"5656 S Maryland Ave, Chicago, Il, 60637",[ 41.7921342  -87.60503297]
An underage person became ill after consuming alcoholic beverages / Medical assistance declined,Referred,Liquor Law Violation,5500 S. University Ave. (Campus North RH),11/1/25 12:29 AM,,2025-11-01 00:29:00-05:00,2025-11-01,Fall,25-01446,"5500 S University Ave, Chicago, Il, 60637",[ 41.79501825 -87.5981983 ]
An underage individual became ill after consuming alcoholic beverages and was transported to UCMED by CFD EMS,Referred,Liquor Law Violation,5630 S. University Ave. (Public Way),10/31/25 11:22 PM,,2025-10-31 23:22:00-05:00,2025-10-31,Fall,25-01445,"5630 S University Ave, Chicago, Il, 60637",[ 41.79266737 -87.59818173]
An underage individual became ill after consuming alcoholic beverages and was transported to UCMED by CFD EMS,Referred,Liquor Law Violation,5700 S. Blackstone Ave. (Public Way),10/31/25 11:01 PM,,2025-10-31 23:01:00-05:00,2025-10-31,Fall,25-01444,"5700 S Blackstone Ave, Chicago, Il, 60637",[ 41.79145183 -87.59032871]
An underage individual became ill after consuming alcoholic beverages and was transported to UCMED by CFD EMS,Referred,Liquor Law Violation,6031 S. Ellis Ave. (Granville-Grossman RH),10/31/25 10:29 PM,,2025-10-31 22:29:00-05:00,2025-10-31,Fall,25-01443,"6031 S Ellis Ave, Chicago, Il, 60637",[ 41.78535247 -87.60110174]
A Motorist opened door into traffic striking a bicyclist / Victim declined medical attention at the time,Closed,Traffic Crash / Minor Injury,1100 E. 57th St. (Public Way),10/31/25 6:18 PM,,2025-10-31 18:20:00-05:00,2025-10-31,Fall,25-01442,"1100 E 57th St, Chicago, Il, 60637",[ 41.79148537 -87.59815254]
An unauthorized subject was given written warning of trespass to UC property,Closed,Information / Trespass Warning,5530 S. Ellis Ave. (Ratner AC),10/31/25 4:20 PM,,2025-10-31 16:20:00-05:00,2025-10-31,Fall,25-01441,"5530 S Ellis Ave, Chicago, Il, 60637",[ 41.79444356 -87.60144801]
A driver's license was found and turned over to UCPD / Owner notified,Closed,Found Property,6100 S. Drexel Ave. (Public Way),10/31/25 10:08 AM,,2025-10-31 10:08:00-05:00,2025-10-31,Fall,25-01437,"6100 S Drexel Ave, Chicago, Il, 60637",[ 41.78311745 -87.60444617]
Unknown vehicle struck parked vehicle and fled,Open,Traffic Crash / Property Damage / Hit and Run,929 E. 57th St. (Public Way),10/30/25 to 10/31/25 12:00 PM to 9:10 AM,,2025-10-31 09:13:00-05:00,2025-10-31,Fall,25-01438,"929 E 57th St, Chicago, Il, 60637",[ 41.79131786 -87.6030103 ]
"Unattended, unsecured iPad and Apple Pencil taken",Open,Theft,1115 E. 58th St. (Rosenwald Hall),10/30/25 6:00 PM to 7:20 PM,,2025-10-30 19:58:00-05:00,2025-10-30,Fall,25-01435,"1115 E 58th St, Chicago, Il, 60637",[ 41.78954358 -87.59832125]
A person in need of medical attention was transported to UCMED by CFD EMS,Closed,Medical Call,1201 E. 60th St. (Rubenstein Forum),10/30/25 5:23 PM,,2025-10-30 17:23:00-05:00,2025-10-30,Fall,25-01434,"1201 E 60th St, Chicago, Il, 60637",[ 41.78596907 -87.59623991]
An unauthorized person was given a trespass warning and escorted off the premises,Closed,Information / Trespass Warning,1452 E. 53rd St. (Polsky Exchange),10/30/25 5:18 PM,,2025-10-30 17:18:00-05:00,2025-10-30,Fall,25-01433,"1452 E 53rd St, Chicago, Il, 60615",[ 41.79958645 -87.59031124]
A person became ill but declined medical attention from CFD EMS,Closed,Medical Call,5747 S. Ellis Ave. (Jones Lab),10/30/25 4:15 PM,,2025-10-30 16:15:00-05:00,2025-10-30,Fall,25-01432,"5747 S Ellis Ave, Chicago, Il, 60637",[ 41.79051653 -87.60120377]
"Credit and debit cards taken from an unattended, unsecured wallet left on a desk",Open,Theft,860 E. 59th St. (Goldblatt),10/30/25 11:45 AM to 11:50 AM,,2025-10-30 15:31:00-05:00,2025-10-30,Fall,25-01431,"860 E 59th St, Chicago, Il, 60637",[ 41.78777846 -87.60375147]
Computer equipment taken from cabinet in office,Open,Theft,860 E. 59th St. (Goldblatt),10/20/25 to 10/29/25 8:00 AM to 10:10 AM,,2025-10-30 11:03:00-05:00,2025-10-30,Fall,25-01430,"860 E 59th St, Chicago, Il, 60637",[ 41.78777846 -87.60375147]
An unknown subject forcibly entered a parked work vehicle and took tools,Open,Theft from Motor Vehicle,6000 S. Stony Island Ave. (Parking Lot),10/30/25 10:49 AM,,2025-10-30 10:49:00-05:00,2025-10-30,Fall,25-01429,"6000 S Stony Island Ave, Chicago, Il, 60637",[ 41.78550276 -87.58665661]
UCPD officers arrested a subject for an active warrant from the Cook County Sheriff's Office,Arrest,Warrant Arrest,1554 E. 55th St. (Walgreens),10/29/25 10:12 PM,,2025-10-29 22:13:00-05:00,2025-10-29,Fall,25-01428,"1554 W 55th St, Chicago, Il, 60609",[ 41.79409491 -87.66382574]
An unknown subject took merchandise from the off-campus store without paying / Referred to CPD,Referred,Information / Theft,1346 E. 53rd St. (Target),10/29/25 5:30 PM,,2025-10-29 17:31:00-05:00,2025-10-29,Fall,2025-058823,"1346 E 53rd St, Chicago, Il, 60615",[ 41.79955044 -87.59306282]
Lost ID card documented,Closed,Lost Property,6054 S. Drexel Ave.,10/24/25 3:30 PM to 4:00 PM,,2025-10-29 16:45:00-05:00,2025-10-29,Fall,25-01426,"6054 S Drexel Ave, Chicago, Il, 60637",[ 41.78450123 -87.60447514]
"Credit cards taken from victim's unattended, unsecured purse",Open,Theft,929 E. 57th St. (Gordon Center),10/28/25 to 10/29/25 10:00 AM to 4:20 PM,,2025-10-29 16:23:00-05:00,2025-10-29,Fall,25-01427,"929 E 57th St, Chicago, Il, 60637",[ 41.79131786 -87.6030103 ]
A person took merchandise from the off-campus store without paying / UCPD officer located and arrested suspect,Arrest,Theft,1554 E. 55th St. (Walgreens),10/29/25 3:31 PM,,2025-10-29 15:31:00-05:00,2025-10-29,Fall,25-01425,"1554 W 55th St, Chicago, Il, 60609",[ 41.79409491 -87.66382574]
3 subjects solicited victim for a contribution / Victim's credit card used for excessive funds / Referred to CPD,Referred,Information / Deceptive Practice,1330 E. 56th St. (Public Way),10/29/25 10:30 AM,,2025-10-29 11:41:00-05:00,2025-10-29,Fall,2025-058779,"1330 E 56th St, Chicago, Il, 60637",[ 41.79335845 -87.59370369]
Two unknown suspects attempted to take property from a victim walking on the sidewalk off-campus / Referred to CPD,Referred,Information / Attempted Robbery,5801 S. Stony Island Ave. (Public Way),10/28/25 10:45 PM,,2025-10-28 22:49:00-05:00,2025-10-28,Fall,2025-058664,"5801 S Stony Island Ave, Chicago, Il, 60649",[ 41.78970379 -87.58659721]
Cell phone found in rideshare vehicle turned over to UCPD for safekeeping,Closed,Found Property,850 E. 61st St. (UCPD HQ),10/28/25 8:05 PM,,2025-10-28 21:30:00-05:00,2025-10-28,Fall,25-01424,"850 E 61st St, Chicago, Il, 60637",[ 41.78412446 -87.60566276]
Unknown person took an unattended pet dog from the sidewalk off-campus / Referred to CPD,Referred,Information / Theft,1658 E. 55th St. (Public Way),10/28/25 8:50 PM,,2025-10-28 21:13:00-05:00,2025-10-28,Fall,2025-058640,"1658 E 55th St, Chicago, Il, 60615",[ 41.79527285 -87.58520495]
Secured electric bicycle taken from bike rack,Open,Theft,5730 S. Ellis Ave. (Crerar Library Bike Rack),10/28/25 1:15 PM to 7:00 PM,,2025-10-28 19:15:00-05:00,2025-10-28,Fall,25-01423,"5730 S Ellis Ave, Chicago, Il, 60637",[ 41.79080003 -87.60136349]
3 unknown suspects attempted to take cash from victim using victim's cell phone in solicitation scam / Referred to CPD,Referred,Information / Attempted Deceptive Practice,1526 E. 55th St. (S. Hyde Park Blvd. Shopping Center),10/28/25 2:50 PM,,2025-10-28 14:55:00-05:00,2025-10-28,Fall,2025-058562,"1526 E 55th St, Chicago, Il, 60615",[ 41.79545686 -87.58927653]
Minor damage to UC owned vehicle documented,Closed,Information / Damage to Vehicle,850 E. 61st St. (UCPD HQ),10/20/25 to 10/28/25 6:30 PM to 12:45 PM,,2025-10-28 12:52:00-05:00,2025-10-28,Fall,25-01422,"850 E 61st St, Chicago, Il, 60637",[ 41.78412446 -87.60566276]
Secured bicycle taken from bike rack,Open,Theft,1116 E. 59th St. (S. Harper Ave. Library Bike Rack),10/24/25 to 10/28/25 5:00 PM to 8:00 AM,,2025-10-28 11:58:00-05:00,2025-10-28,Fall,25-01421,"1116 E 59th St, Chicago, Il, 60637",[ 41.78782808 -87.59934635]
Sunroof shattered and steering column damaged in 2015 Infiniti parked on the street,Open,Criminal Damage to Vehicle,5611 S. Cottage Grove Ave. (Public Way),10/28/25 5:50 AM to 11:00 AM,,2025-10-28 11:35:00-05:00,2025-10-28,Fall,25-01420,"5611 S Cottage Grove Ave, Chicago, Il, 60637",[ 41.79292518 -87.60611012]
Lost property documented,Closed,Lost Property,850 E. 61st St. (UCPD HQ),10/23/25 to 10/28/25 10:00 AM to 8:20 AM,,2025-10-28 08:36:00-05:00,2025-10-28,Fall,25-01419,"850 E 61st St, Chicago, Il, 60637",[ 41.78412446 -87.60566276]
Suspicious person street stop documented,Closed,Information,1418 E. 53rd St. (Parking Lot),10/28/25 6:45 AM,,2025-10-28 06:52:00-05:00,2025-10-28,Fall,25-01418,"1418 E 53rd St, Chicago, Il, 60615",[ 41.79956926 -87.59144614]
A person was stuck in a room after a key broke in the deadbolt lock / CFD responded and gained entry / Person declined medical attention,Closed,Information,5757 S. University Ave. (Saieh Hall),10/27/25 3:24 PM to 5:24 PM,,2025-10-27 17:25:00-05:00,2025-10-27,Fall,25-01417,"5757 S University Ave, Chicago, Il, 60637",[ 41.79039937 -87.59797476]
Death investigation documented / CPD case JJ467395,CPD,Information / Death Investigation,1156 E. 61st St. (S. Woodlawn Ave. RC),10/27/25 3:00 PM,,2025-10-27 15:55:00-05:00,2025-10-27,Fall,25-01416,"1156 E 61st St, Chicago, Il, 60637",[ 41.78420791 -87.5974474 ]
Unknown subjects soliciting donations used victim's phone to withdraw funds from the victim's account / Referred to CPD,Referred,Information / Deceptive Practice,1526 E. 55th St. (S. Hyde Park Blvd. Shopping Center),10/27/25 3:00 PM,,2025-10-27 15:11:00-05:00,2025-10-27,Fall,2025-058328,"1526 E 55th St, Chicago, Il, 60615",[ 41.79545686 -87.58927653]
Patient's property taken from room,Open,Theft,5700 S. Maryland Ave. (CCD),10/24/25 2:30 PM to 10:30 PM,,2025-10-27 14:44:00-05:00,2025-10-27,Fall,25-01415,"5700 S Maryland Ave, Chicago, Il, 60637",[ 41.7903992  -87.60501721]
Leather seats on several chairs were damaged,Open,Damage to Property,5706 S. University Ave. (Reynolds Club),10/24/25 to 10/27/25 5:00 PM to 7:00 AM,,2025-10-27 12:45:00-05:00,2025-10-27,Fall,25-01413,"5706 S University Ave, Chicago, Il, 60637",[ 41.79126654 -87.59814716]
An unknown subject took merchandise from the off-campus store without paying / Referred to CPD,Referred,Information / Theft,1554 E. 55th St. (Walgreens),10/27/25 12:30 PM,,2025-10-27 12:32:00-05:00,2025-10-27,Fall,2025-058303,"1554 W 55th St, Chicago, Il, 60609",[ 41.79409491 -87.66382574]
A person was transported to UCMED by CFD EMS for evaluation,Closed,Medical Transport,1009 E. 57th St. (Hitchcock Hall),10/27/25 12:25 PM,,2025-10-27 12:29:00-05:00,2025-10-27,Fall,25-01414,"1009 E 57th St, Chicago, Il, 60637",[ 41.79133942 -87.60104438]
An unknown subject took merchandise from the off-campus store without paying / Referred to CPD,Referred,Information / Theft,1554 E. 55th St. (Walgreens),10/27/25 10:00 AM,,2025-10-27 10:05:00-05:00,2025-10-27,Fall,2025-058281,"1554 W 55th St, Chicago, Il, 60609",[ 41.79409491 -87.66382574]
Information of suspicious persons both on and off campus documented,Closed,Information,1101 E. 57th St. (Zoology),10/26/25 3:30 PM,Attempted Armed Robbery,2025-10-26 15:31:00-05:00,2025-10-26,Fall,25-01412,"1101 E 57th St, Chicago, Il, 60637",[ 41.7913596 -87.598996 ]
An unknown subject took merchandise from the off-campus store without paying / Referred to CPD,Referred,Information / Theft,1550 E. 55th St. (La Boulangerie),10/26/25 2:40 PM,,2025-10-26 14:44:00-05:00,2025-10-26,Fall,2025-058123,"1550 W 55th St, Chicago, Il, 60609",[ 41.79409803 -87.66376339]
A vehicle reported stolen to CPD was found parked and unoccupied by UCPD officer / Owners notified,Closed,Motor Vehicle Recovery,5505 S. Ellis Ave. (Parking Structure),10/26/25 11:45 AM,,2025-10-26 11:45:00-05:00,2025-10-26,Fall,25-01411,"5505 S Ellis Ave, Chicago, Il, 60637",[ 41.79483054 -87.60129259]
Unknown suspects struck off-campus ATM with sledgehammers before fleeing the scene in two vehicles / CPD case JJ465763,CPD,Information / Damage to Property,"1354 E. 55th St. St, (BankFinancial)",10/26/25 9:05 AM,,2025-10-26 09:08:00-05:00,2025-10-26,Fall,2025-058055,"1354 E 55th St, Chicago, Il, 60615",[ 41.79516745 -87.59347688]
"During a confrontation, a visitor grabbed a UCM staff member / Victim declined to sign complaint",Ex. Cleared,Battery,5656 S. Maryland Ave. (UCMED),10/26/25 3:10 AM,,2025-10-26 03:10:00-05:00,2025-10-26,Fall,25-01408,"5656 S Maryland Ave, Chicago, Il, 60637",[ 41.7921342  -87.60503297]
Minor damage to UC owned vehicle documented,Closed,Information,5700 S. Lake Shore Dr. (Public Way),10/26/25 2:56 AM,,2025-10-26 02:56:00-05:00,2025-10-26,Fall,25-01410,"5700 S Lake Shore Dr, Chicago, Il, 60637",[ 41.79168654 -87.58028186]
Vehicle pursuit documented,Open,Other Vehicle Offense / Aggravated Fleeing and Eluding,5400 S. Harper Ave. (Public Way),10/26/25 2:37 AM,,2025-10-26 02:45:00-05:00,2025-10-26,Fall,25-01409,"5400 S Harper Ave, Chicago, Il, 60615",[ 41.79802222 -87.58913225]
A person in need of medical care was transported to UCMED,Closed,Medical Call,840 E. 59th St. (Student Wellness),10/25/25 4:36 PM,,2025-10-25 16:36:00-05:00,2025-10-25,Fall,25-01407,"840 E 59th St, Chicago, Il, 60637",[ 41.78777742 -87.60410742]
A person was trapped in an elevator between floors / CFD arrived and freed the occupant,Closed,Information,5630 S. University Ave. (Max Palevsky RC),10/25/25 2:20 PM,,2025-10-25 14:21:00-05:00,2025-10-25,Fall,25-01406,"5630 S University Ave, Chicago, Il, 60637",[ 41.79266737 -87.59818173]
Ida Noyes staff turned over several keys that were found during a period of months / Inventoried for safekeeping,Closed,Found Property,1212 E. 59th St. (Ida Noyes),10/25/25 11:43 AM,,2025-10-25 11:43:00-05:00,2025-10-25,Fall,25-01404,"1212 E 59th St, Chicago, Il, 60637",[ 41.78786653 -87.59611988]
"During a domestic argument off-campus, an ex-boyfriend physically assaulted victim before fleeing / CPD case JJ464620",CPD,Information / Domestic Battery,6100 S. Woodlawn Ave. (Public Way),10/25/25 8:25 AM,,2025-10-25 08:30:00-05:00,2025-10-25,Fall,2025-057787,"6100 S Woodlawn Ave, Chicago, Il, 60637",[ 41.78410781 -87.59636316]
An underage individual became ill after consuming alcoholic beverages and was transported to UCMED by CFD EMS,Referred,Liquor Law Violation,5630 S. University Ave. (Max Palevsky RC),10/25/25 2:24 AM,,2025-10-25 02:24:00-05:00,2025-10-25,Fall,25-01403,"5630 S University Ave, Chicago, Il, 60637",[ 41.79266737 -87.59818173]
An underage individual became ill after consuming alcoholic beverages and was transported to UCMED by CFD EMS,Referred,Liquor Law Violation,5345 S. University Ave. (Public Way),10/25/25 1:41 AM,,2025-10-25 01:41:00-05:00,2025-10-25,Fall,25-01402,"5345 S University Ave, Chicago, Il, 60615",[ 41.79877556 -87.59808442]
An underage individual became ill after consuming alcoholic beverages and was transported to UCMED by CFD EMS,Referred,Liquor Law Violation,5500 S. University Ave. (Campus North RH),10/25/25 1:12 AM,,2025-10-25 01:14:00-05:00,2025-10-25,Fall,25-01401,"5500 S University Ave, Chicago, Il, 60637",[ 41.79501825 -87.5981983 ]
An unknown subject unlawfully discharged a firearm off-campus / No injuries or property damage reported CPD case JJ464440,CPD,Information / Unlawful Discharge of a Firearm,3992 S. Lake Park Ave. (Public Way),10/25/25 1:10 AM,,2025-10-25 01:12:00-05:00,2025-10-25,Fall,2025-057721,"3992 S Lake Park Ave, Chicago, Il, 60653",[ 41.82260267 -87.60247858]
An underage individual became ill after consuming alcoholic beverages and was transported to UCMED by CFD EMS,Referred,Liquor Law Violation,1156 E. 61st St. (S. Woodlawn Ave. RC),10/25/25 12:50 AM,,2025-10-25 00:50:00-05:00,2025-10-25,Fall,25-01400,"1156 E 61st St, Chicago, Il, 60637",[ 41.78420791 -87.5974474 ]
Two sets of keys found in rideshare vehicle were turned over to UCPD for safekeeping,Closed,Found Property,850 E. 61st St. (UCPD HQ),10/24/25 7:24 PM,,2025-10-24 20:06:00-05:00,2025-10-24,Fall,25-01399,"850 E 61st St, Chicago, Il, 60637",[ 41.78412446 -87.60566276]
Unsecured bicycle taken from bike rack off-campus / Referred to CPD,Referred,Information / Theft,1369 E. 53rd St. (Public Way),10/24/25 3:30 PM to 5:30 PM,,2025-10-24 18:19:00-05:00,2025-10-24,Fall,2025-057587,"1369 E 53rd St, Chicago, Il, 60615",[ 41.79944486 -87.59241986]
Information regarding a patient using a recording device was documented,Closed,Information,5700 S. Maryland Ave. (CCD),10/24/25 4:24 PM,,2025-10-24 16:24:00-05:00,2025-10-24,Fall,25-01398,"5700 S Maryland Ave, Chicago, Il, 60637",[ 41.7903992  -87.60501721]
An unknown subject took merchandise from the off-campus store without paying / Referred to CPD,Referred,Information / Theft,1554 E. 55th St. (Walgreens),10/24/25 3:48 PM,,2025-10-24 15:49:00-05:00,2025-10-24,Fall,2025-057562,"1554 W 55th St, Chicago, Il, 60609",[ 41.79409491 -87.66382574]
"Credit cards taken from unsecured, unattended wallets left in work area / Subsequent unauthorized use of bank cards reported",Open,Theft,5815 S. Maryland Ave. (Mitchell Hospital),10/24/25 12:30 PM to 2:30 PM,,2025-10-24 15:27:00-05:00,2025-10-24,Fall,25-01396,"5815 S Maryland Ave, Chicago, Il, 60637",[ 41.78922352 -87.60487504]
"Credit cards taken from unsecured, unattended wallets left in work area / Subsequent unauthorized use of bank cards reported",Open,Theft,5815 S. Maryland Ave. (Mitchell Hospital),10/24/25 12:30 PM to 2:30 PM,,2025-10-24 15:27:00-05:00,2025-10-24,Fall,25-01397,"5815 S Maryland Ave, Chicago, Il, 60637",[ 41.78922352 -87.60487504]
A patient struck a UCMED staff member / Arrested by UCPD,Arrest,Battery,5656 S. Maryland Ave. (UCMED),10/24/25 12:42 PM,,2025-10-24 12:44:00-05:00,2025-10-24,Fall,25-01394,"5656 S Maryland Ave, Chicago, Il, 60637",[ 41.7921342  -87.60503297]
Patient caused a disturbance in waiting room / Peace restored,Closed,Information,5656 S. Maryland Ave. (UCMED),10/24/25 12:08 PM,Armed Robbery Arrest / Attempted Armed Robbery,2025-10-24 12:08:00-05:00,2025-10-24,Fall,25-01395,"5656 S Maryland Ave, Chicago, Il, 60637",[ 41.7921342  -87.60503297]
An unknown subject took merchandise from the off-campus store without paying / Referred to CPD,Referred,Information / Theft,1554 E. 55th St. (Walgreens),10/24/25 10:10 AM,,2025-10-24 10:12:00-05:00,2025-10-24,Fall,2025-057500,"1554 W 55th St, Chicago, Il, 60609",[ 41.79409491 -87.66382574]
Water leak discovered / Facilities notified,Closed,Information,850 E. 61st St. (UCPD HQ),10/24/25 2:08 AM,,2025-10-24 02:10:00-05:00,2025-10-24,Fall,25-01393,"850 E 61st St, Chicago, Il, 60637",[ 41.78412446 -87.60566276]
A person in need of medical attention was transported to UCMED by CFD EMS,Closed,Medical Call,1414 E. 59th St. (I-House),10/23/25 5:39 PM,,2025-10-23 17:39:00-05:00,2025-10-23,Fall,25-01391,"1414 E 59th St, Chicago, Il, 60637",[ 41.78791518 -87.59109314]
A secured electric scooter taken from bike rack,Open,Theft,1150 E. 58th St. (Saieh Hall Bike Rack),10/23/25 2:00 PM to 3:00 PM,,2025-10-23 15:13:00-05:00,2025-10-23,Fall,25-01390,"1150 E 58th St, Chicago, Il, 60637",[ 41.78967746 -87.59681877]
A person in need of medical attention was transported to Comer Hospital by CFD EMS,Closed,Medical Call,1362 E. 59th St. (Blaine Hall),10/23/25 1:35 PM,,2025-10-23 13:40:00-05:00,2025-10-23,Fall,25-01389,"1362 E 59th St, Chicago, Il, 60637",[ 41.78789688 -87.59272762]
A New York driver's license was found and turned over to UCPD for safekeeping,Closed,Found Property,5555 S. Everett Ave. (Public Way),10/23/25 12:43 PM,,2025-10-23 12:44:00-05:00,2025-10-23,Fall,25-01388,"5555 S Everett Ave, Chicago, Il, 60637",[ 41.79396879 -87.58242615]
UC owned vehicle involved in a property damage crash,Closed,Traffic Crash,5517 S. Dorchester Ave. (Public Way),10/23/25 11:20 AM,,2025-10-23 11:21:00-05:00,2025-10-23,Fall,25-01386,"5517 S Dorchester Ave, Chicago, Il, 60637",[ 41.79457698 -87.59159225]
A subject took merchandise from the off-campus store without paying / A UCPD officer located and arrested the suspect,Arrest,Theft,1554 E. 55th St. (Walgreens),10/23/25 10:10 AM,,2025-10-23 10:22:00-05:00,2025-10-23,Fall,25-01387,"1554 W 55th St, Chicago, Il, 60609",[ 41.79409491 -87.66382574]
A suspcious person attempting to enter building was documented,Open,Information,1452 E. 53rd St. (Polsky Exchange North),10/22/25 11:15 PM,,2025-10-22 23:15:00-05:00,2025-10-22,Fall,25-01385,"1452 E 53rd St, Chicago, Il, 60615",[ 41.79958645 -87.59031124]
"Unattended, unsecured bag taken from work area",Open,Theft,5815 S. Maryland Ave. (Mitchell Hospital),10/22/25 11:57 AM to 12:21 PM,,2025-10-22 12:58:00-05:00,2025-10-22,Fall,25-01384,"5815 S Maryland Ave, Chicago, Il, 60637",[ 41.78922352 -87.60487504]
Two water hoses cut,Open,Damage to Property,800 E. 55th St. (Friend Center),10/17/25 to 10/20/25 5:30 PM to 7:00 AM,,2025-10-22 07:04:00-05:00,2025-10-22,Fall,25-01383,"800 E 55th St, Chicago, Il, 60615",[ 41.79502429 -87.60613905]
Window smashed and property taken from vehicle parked on the street off-campus / Referred to CPD,Referred,Information / Theft,5300 S. Ellis Ave. (Public Way),10/21/25 to 10/22/25 11:00 PM to 5:50 AM,,2025-10-22 05:54:00-05:00,2025-10-22,Fall,2025-057022,"5300 S Ellis Ave, Chicago, Il, 60615",[ 41.79934458 -87.60138037]
Window smashed and property taken from vehicle parked in a parking lot off-campus / Referred to CPD,Referred,Information / Theft,1301 E. 47th St. (Parking Lot),10/22/25 unknown time,,2025-10-22 05:54:00-05:00,2025-10-22,Fall,2025-057023,"1301 E 47th St, Chicago, Il, 60653",[ 41.80960615 -87.59460918]
Patient complaint documented,Closed,Information,5815 S. Maryland Ave. (Mitchell Hospital),10/21/25 7:00 PM,,2025-10-21 21:28:00-05:00,2025-10-21,Fall,25-01382,"5815 S Maryland Ave, Chicago, Il, 60637",[ 41.78922352 -87.60487504]
A subject was arrested for leaving the scene of a traffic crash,Arrest,Traffic Crash / Property Damage / Hit and Run,6239 S. Ellis Ave. (Public Way),10/21/25 9:26 PM,,2025-10-21 21:26:00-05:00,2025-10-21,Fall,25-01381,"6239 S Ellis Ave, Chicago, Il, 60637",[ 41.78174431 -87.60101748]
Property taken from truck parked on the street,Open,Theft,1323 E. 61st St. (Public Way),10/21/25 5:00 PM to 6:30 PM,,2025-10-21 18:47:00-05:00,2025-10-21,Fall,25-01380,"1323 E 61st St, Chicago, Il, 60637",[ 41.78413586 -87.59370196]
A victim was inappropriately touched by a co-worker,Open,Battery,850 E. 59th St. (Goldblatt Hospital),10/21/25 6:00 PM,,2025-10-21 18:35:00-05:00,2025-10-21,Fall,25-01379,"850 E 59th St, Chicago, Il, 60637",[ 41.78777846 -87.60392874]
Complaint of patient use of camera during treatment documented,Closed,Information,5700 S. Maryland Ave. (CCD),10/21/25 5:20 PM,,2025-10-21 17:44:00-05:00,2025-10-21,Fall,25-01378,"5700 S Maryland Ave, Chicago, Il, 60637",[ 41.7903992  -87.60501721]
A subject took merchandise without paying and was detained by UCPD / Management declined to prosecute / Subject issued a trespass warning,Ex. Cleared,Theft,1131 E. 57th St. (Hutchinson Commons),10/21/25 4:06 PM,,2025-10-21 16:07:00-05:00,2025-10-21,Fall,25-01377,"1131 E 57th St, Chicago, Il, 60637",[ 41.79136831 -87.59832779]
A construction fence fell and damaged a person's vehicle,Closed,Non-Criminal Property Damage,5800 S. University Ave. (Public Way),10/21/25 1:53 PM,,2025-10-21 13:53:00-05:00,2025-10-21,Fall,25-01375,"5800 S University Ave, Chicago, Il, 60637",[ 41.78955283 -87.5981092 ]
A person fell outside of the Gordon Center / Transported to UCMED by CFD EMS,Closed,Injured Person,929 E. 57th St. (Gordon Center),10/21/25 1:20 PM,,2025-10-21 13:27:00-05:00,2025-10-21,Fall,25-01374,"929 E 57th St, Chicago, Il, 60637",[ 41.79131786 -87.6030103 ]
A person took merchandise from the off- campus store without paying / Suspect located and arrested by UCPD officer,Arrest,Theft,1346 E. 53rd St. (Target),10/21/25 1:12 PM,,2025-10-21 13:13:00-05:00,2025-10-21,Fall,25-01376,"1346 E 53rd St, Chicago, Il, 60615",[ 41.79955044 -87.59306282]
UC owned vehicle involved in minor traffic crash,Closed,Traffic Crash / Property Damage,5300 S. Lake Park Ave. (Public Way),10/21/25 7:42 AM,,2025-10-21 07:42:00-05:00,2025-10-21,Fall,25-01373,"5300 S Lake Park Ave, Chicago, Il, 60615",[ 41.79950162 -87.58737772]
A suspect took a bag of groceries from a person walking on the sidewalk off-campus / Suspect located and detained by UCPD officer / Victim declined to prosecute,Ex. Cleared,Theft from Person,1348 E. 55th St. (Public Way),10/20/25 11:16 PM,,2025-10-20 23:23:00-05:00,2025-10-20,Fall,25-01371,"1348 E 55th St, Chicago, Il, 60615",[ 41.79516673 -87.59362983]
A person was transported to UCMED for evaluation,Closed,Medical Transport,5500 S. University Ave. (Campus North RH),10/20/25 10:15 PM,,2025-10-20 22:15:00-05:00,2025-10-20,Fall,25-01372,"5500 S University Ave, Chicago, Il, 60637",[ 41.79501825 -87.5981983 ]
A disorderly individual was counseled by UCPD officer / Peace restored,Closed,Information,5735 S. Ellis Ave. (Searle Lab),10/20/25 5:02 PM,Armed Robbery Arrest,2025-10-20 17:05:00-05:00,2025-10-20,Fall,25-01370,"5735 S Ellis Ave, Chicago, Il, 60637",[ 41.79073052 -87.60120831]
A licensed firearm was taken from a visitor and held at UCPD for safekeeping,Closed,Found Property,5721 S. Maryland Ave. (Comer Hospital),10/20/25 4:54 PM,,2025-10-20 16:54:00-05:00,2025-10-20,Fall,25-01369,"5721 S Maryland Ave, Chicago, Il, 60637",[ 41.79028249 -87.60486169]
"Wallet in unsecured, unattended purse was taken",Open,Theft,900 E. 57th St. (Knapp Center),10/17/25 8:00 AM to 2:15 PM,,2025-10-20 15:30:00-05:00,2025-10-20,Fall,25-01368,"900 E 57th St, Chicago, Il, 60637",[ 41.79142346 -87.60366292]
Window shattered in vehicle parked on the street off-campus / Referred to CPD,Referred,Information / Criminal Damage to Vehicle,6108 S. Ingleside Ave. (Public Way),10/19/25 to 10/20/25 7:00 PM to 1:40 PM,,2025-10-20 13:43:00-05:00,2025-10-20,Fall,2025-056539,"6108 S Ingleside Ave, Chicago, Il, 60637",[ 41.78391935 -87.60283948]
An unknown subject took merchandise from the off-campus store without paying / Referred to CPD,Referred,Information / Theft,1554 E. 55th St. (Walgreens),10/20/25 12:40 PM,,2025-10-20 12:44:00-05:00,2025-10-20,Fall,2025-056532,"1554 W 55th St, Chicago, Il, 60609",[ 41.79409491 -87.66382574]
An unknown subject took merchandise from the off-campus store without paying / Referred to CPD,Referred,Information / Theft,1346 E. 53rd St. (Target),10/20/25 10:00 AM,,2025-10-20 10:04:00-05:00,2025-10-20,Fall,2025-056512,"1346 E 53rd St, Chicago, Il, 60615",[ 41.79955044 -87.59306282]
An unknown subject riding a Divvy bike snatched a bag from the hand of a person standing on the sidewalk off-campus / Referred to CPD,Referred,Information / Theft,6106 S. University Ave. (Public Way),10/17/25 1:50 PM,,2025-10-20 09:54:00-05:00,2025-10-20,Fall,2025-056508,"6106 S University Ave, Chicago, Il, 60637",[ 41.783985   -87.59798064]
An unknown subject took merchandise from the off-campus store without paying / Referred to CPD,Referred,Information / Theft,1554 E. 55th St. (Walgreens),10/20/25 7:40 AM,,2025-10-20 07:41:00-05:00,2025-10-20,Fall,2025-056485,"1554 W 55th St, Chicago, Il, 60609",[ 41.79409491 -87.66382574]
A person reported harassing emails from a known person,Open,Harassment by Electronic Means,850 E. 61st St. (UCPD HQ),10/19/25 12:50 PM,,2025-10-19 14:50:00-05:00,2025-10-19,Fall,25-01367,"850 E 61st St, Chicago, Il, 60637",[ 41.78412446 -87.60566276]
Wallet taken from patient's property,Open,Theft,5815 S. Maryland Ave. (Mitchell Hospital),10/17/25 to 10/19/25 6:00 PM to 1:00 PM,,2025-10-19 13:20:00-05:00,2025-10-19,Fall,25-01366,"5815 S Maryland Ave, Chicago, Il, 60637",[ 41.78922352 -87.60487504]
UCPD responded to a call of an unknown subject creating a disturbance inside of the off-campus store / Subject fled before police arrived,Closed,Information / Disorderly Conduct,1554 E. 55th St. (Walgreens),10/19/25 7:40 AM,,2025-10-19 07:45:00-05:00,2025-10-19,Fall,2025-056316,"1554 W 55th St, Chicago, Il, 60609",[ 41.79409491 -87.66382574]
A person was transported to UCMED by CFD EMS for evaluation,Closed,Medical Transport,1554 E. 55th St. (S. Hyde Park Blvd. Shopping Center),10/19/25 4:02 AM,,2025-10-19 04:02:00-05:00,2025-10-19,Fall,25-01365,"1554 W 55th St, Chicago, Il, 60609",[ 41.79409491 -87.66382574]
A suspicious person was reported loitering outside of the building / UCPD responded,Closed,Information,5500 S. University Ave. (Campus North RH),10/19/25 1:50 AM,,2025-10-19 01:55:00-05:00,2025-10-19,Fall,25-01364,"5500 S University Ave, Chicago, Il, 60637",[ 41.79501825 -87.5981983 ]
Clothes taken from laundry room,Open,Theft,1156 E. 61st St. (S. Woodlawn Ave. RC),10/18/25 8:45 PM to 9:30 PM,,2025-10-18 21:53:00-05:00,2025-10-18,Fall,25-01363,"1156 E 61st St, Chicago, Il, 60637",[ 41.78420791 -87.5974474 ]
A person in need of medical attention was transported to UCMED by CFD EMS,Closed,Medical Call,5550 S. Greenwood Ave. (Smart Museum),10/18/25 4:52 PM,,2025-10-18 16:53:00-05:00,2025-10-18,Fall,25-01362,"5550 S Greenwood Ave, Chicago, Il, 60637",[ 41.79411116 -87.59983537]
A subject took merchandise from the off-campus store without paying / Suspect located and arrested by UCPD,Arrest,Theft,1554 E. 55th St. (Walgreens),10/18/25 3:01 PM,,2025-10-18 15:08:00-05:00,2025-10-18,Fall,25-01361,"1554 W 55th St, Chicago, Il, 60609",[ 41.79409491 -87.66382574]
Victim reported loss of funds when involved in a social media con game,Open,Deceptive Practice / Con Game,850 E. 61st St. (UCPD HQ),10/18/25 1:28 PM,,2025-10-18 13:34:00-05:00,2025-10-18,Fall,25-01360,"850 E 61st St, Chicago, Il, 60637",[ 41.78412446 -87.60566276]
"Unattended, unsecured laptop taken",Open,Theft,1100 E. 57th St. (Regenstein Library),10/17/25 to 10/18/25 4:00 PM to 10:30 AM,,2025-10-18 12:45:00-05:00,2025-10-18,Fall,25-01359,"1100 E 57th St, Chicago, Il, 60637",[ 41.79148537 -87.59815254]
Ongoing dispute between co-workers documented,Open,Disorderly Conduct,5837 S. Maryland Ave. (Mitchell Hospital),3/25/25 to 10/2/25 11:45 PM to 11:30 PM,,2025-10-18 08:54:00-05:00,2025-10-18,Fall,25-01358,"5837 S Maryland Ave, Chicago, Il, 60637",[ 41.78884314 -87.6048599 ]
An unknown subject unlawfully entered an off-campus residence and took property / Referred to CPD,Referred,Information / Burglary,E. 54th St. between S. Greenwood Ave. and S. University Ave.,10/18/25 12:30 AM to 5:30 AM,,2025-10-18 06:09:00-05:00,2025-10-18,Fall,2025-056107,"5405 S Greenwood Ave, Chicago, Il 60615",[ 41.7977273 -87.5993795]
Two acquaintances involved in a physical altercation on the sidewalk off-campus / Peace restored,Closed,Battery,1450 E. 55th St. (Public Way),10/18/25 2:00 AM,,2025-10-18 02:05:00-05:00,2025-10-18,Fall,25-01357,"1450 E 55th St, Chicago, Il, 60615",[ 41.79558145 -87.59007722]
An underage individual became ill after consuming alcoholic beverages and was transported to UCMED by CFD EMS,Referred,Liquor Law Violation,5429 S. Greenwood Ave. (Public Way),10/18/25 1:41 AM,,2025-10-18 01:41:00-05:00,2025-10-18,Fall,25-01356,"5429 S Greenwood Ave, Chicago, Il, 60615",[ 41.79757843 -87.59962409]
An underage individual became ill after consuming alcoholic beverages and was transported to UCMED by CFD EMS,Referred,Liquor Law Violation,1100 E. 58th St. (Main Quad),10/18/25 12:12 AM,,2025-10-18 00:13:00-05:00,2025-10-18,Fall,25-01355,"1100 W 58th St, Chicago, Il, 60621",[ 41.78877746 -87.6535956 ]
"During the course of a domestic dispute, boyfriend struck girlfriend / Suspect arrested by UCPD",Arrest,Domestic Battery,4710 S. Greenwood Ave. (Public Way),10/17/25 8:52 PM,,2025-10-17 20:52:00-05:00,2025-10-17,Fall,25-01354,"4710 S Greenwood Ave, Chicago, Il, 60615",[ 41.80920871 -87.59933386]
A rideshare vehicle ran over passenger's foot,Closed,Traffic Crash / Minor Injury,809 E. 54th St. (Public Way),10/17/25 8:33 PM,,2025-10-17 20:48:00-05:00,2025-10-17,Fall,25-01353,"809 E 54th St, Chicago, Il, 60615",[ 41.79674486 -87.60577308]
Car keys found and turned over to UCPD for safekeeping,Closed,Found Property,"1362 E. 59th St. St, (Public Way)",10/17/25 3:23 PM,,2025-10-17 15:23:00-05:00,2025-10-17,Fall,25-01352,"1362 E 59th St, Chicago, Il, 60637",[ 41.78789688 -87.59272762]
A subject was transported to UCMED by CFD EMS for evaluation,Closed,Medical Transport,1400 E. Midway Plaisance),10/17/25 1:37 PM,,2025-10-17 13:37:00-05:00,2025-10-17,Fall,25-01351,"1400 East Midway Plaisance, Chicago, Il 60637",[ 41.7872049 -87.5990833]
Found keys were turned over to UCPD for safekeeping,Closed,Found Property,850 E. 61st St. (UCPD HQ),10/17/25 1:25 PM,,2025-10-17 13:32:00-05:00,2025-10-17,Fall,25-01350,"850 E 61st St, Chicago, Il, 60637",[ 41.78412446 -87.60566276]
"An unknown subject, without provocation, struck victim with his fist and walked off",Open,Battery,5500 S. Ellis Ave. (Public Way),10/17/25 12:09 AM,,2025-10-17 12:01:00-05:00,2025-10-17,Fall,25-01348,"5500 S Ellis Ave, Chicago, Il, 60637",[ 41.79498535 -87.60141279]
A vehicle sideswiped another vehicle and drove off,Open,Traffic Crash / Minor Personal Injury / Hit and Run,5800 S. Ellis Ave. (Public Way),10/17/25 10:10 AM,,2025-10-17 10:44:00-05:00,2025-10-17,Fall,25-01349,"5800 S Ellis Ave, Chicago, Il, 60637",[ 41.78955247 -87.60133695]
Two backpacks left unattended and unsecured were taken,Open,Theft,5640 S. University Ave. (Bartlett Commons),10/17/25 9:10 AM,,2025-10-17 09:52:00-05:00,2025-10-17,Fall,25-01347,"5640 S University Ave, Chicago, Il, 60637",[ 41.79249355 -87.59817745]
A person became ill after consuming alcoholic beverages and was transported to UCMED by CFD EMS,Referred,Liquor Law Violation,5500 S. University Ave. (Campus North RH),10/17/25 3:09 AM,,2025-10-17 03:05:00-05:00,2025-10-17,Fall,25-01346,"5500 S University Ave, Chicago, Il, 60637",[ 41.79501825 -87.5981983 ]
A person stuck in elevator was freed by CFD,Closed,Elevator Entrapment,1201 E. 60th St. (Rubenstein Forum),10/16/25 9:24 PM,,2025-10-16 21:29:00-05:00,2025-10-16,Fall,25-01344,"1201 E 60th St, Chicago, Il, 60637",[ 41.78596907 -87.59623991]
A subject was transported to Provident Hospital for evaluation,Closed,Medical Transport,5100 S. Lake Park Ave. (Public Way),10/16/25 9:27 PM,,2025-10-16 21:27:00-05:00,2025-10-16,Fall,25-01345,"5100 S Lake Park Ave, Chicago, Il, 60615",[ 41.80240432 -87.58791872]
Two victims were solicited for contributions via their cell phones / Contributions were inflated by three unknown suspects,Open,Deceptive Practice / Confidence Game,5800 S. Kimbark Ave. (Public Way),10/16/25 4:05 PM,,2025-10-16 16:13:00-05:00,2025-10-16,Fall,25-01343,"5800 S Kimbark Ave, Chicago, Il, 60637",[ 41.78957981 -87.59486917]
Forged check scheme documented,Open,Deceptive Practice / Forgery,6030 S. Ellis Ave. (Edelstone Hall),9/8/25 to 9/12/25 10:00 AM to 5:00 PM,,2025-10-16 14:23:00-05:00,2025-10-16,Fall,25-01342,"6030 S Ellis Ave, Chicago, Il, 60637",[ 41.78535036 -87.60125539]
Secured bicycle taken from bike rack,Open,Theft,1414 E. 59th St. (I-House Bike Rack),10/11/25 to 10/12/25 6:00 PM to 12:00 PM,,2025-10-16 13:51:00-05:00,2025-10-16,Fall,25-01341,"1414 E 59th St, Chicago, Il, 60637",[ 41.78791518 -87.59109314]
Damage to equipment documented,Closed,Non-Criminal Property Damage,850 E. 61st St. (UCPD HQ),10/16/25 7:24 AM,,2025-10-16 07:24:00-05:00,2025-10-16,Fall,25-01340,"850 E 61st St, Chicago, Il, 60637",[ 41.78412446 -87.60566276]
A UCM staff member found suspect narcotics in the possession of a patient and turned the contraband over to UCPD for proper disposal,Closed,Found Narcotic,5700 S. Maryland Ave. (CCD),10/16/25 3:00 AM,,2025-10-16 03:18:00-05:00,2025-10-16,Fall,25-01339,"5700 S Maryland Ave, Chicago, Il, 60637",[ 41.7903992  -87.60501721]
A secured electric scooter taken from bike rack,Open,Theft,1100 E. 57th St. (Regenstein Library Bike Rack),10/15/25 1:45 PM to 7:05 PM,,2025-10-15 19:16:00-05:00,2025-10-15,Fall,25-01337,"1100 E 57th St, Chicago, Il, 60637",[ 41.79148537 -87.59815254]
"A subject, without provocation, threatened two victims walking on the sidewalk off-campus / Arrested by UCPD",Arrest,Assault,1535 E. 56th St. (Public Way),10/15/25 3:40 PM,,2025-10-15 15:42:00-05:00,2025-10-15,Fall,25-01336,"1535 E 56th St, Chicago, Il, 60637",[ 41.79329786 -87.58823384]
Victim and visitor involved in verbal dispute that became physical / Victim declined to press charges,Ex. Cleared,Battery,5700 S. Maryland Ave. (CCD),10/15/25 1:56 PM,,2025-10-15 13:58:00-05:00,2025-10-15,Fall,25-01335,"5700 S Maryland Ave, Chicago, Il, 60637",[ 41.7903992  -87.60501721]
Wallet was taken,Open,Theft,1055 E. 55th St. (Roux),10/15/25 10:00 AM to 10:40 AM,,2025-10-15 13:27:00-05:00,2025-10-15,Fall,25-01334,"1055 E 55th St, Chicago, Il, 60615",[ 41.7949637  -87.60047086]
Person reported lost wallet,Closed,Lost Property,970 E. 58th St. (UC Bookstore),10/8/25 to 10/9/25 2:00 PM to 9:00 AM,,2025-10-15 09:25:00-05:00,2025-10-15,Fall,25-01333,"970 E 58th St, Chicago, Il, 60637",[ 41.78958698 -87.60472689]
Bicycle taken from rear yard / Referred to CPD,Referred,Information / Theft,917 E. 54th Pl.,10/14/25 5:00 PM,,2025-10-15 08:26:00-05:00,2025-10-15,Fall,2025-055330,"917 E 54th Pl, Chicago, Il, 60615",[ 41.79640859 -87.60298307]
A motorist physically resisted a UCPD officer subsequent to a traffic stop / Suspect charged with felony,Arrest,Battery / Resisting Arrest,6131 S. Ellis Ave. (Public Way),10/15/25 4:52 AM,,2025-10-15 04:52:00-05:00,2025-10-15,Fall,25-01332,"6131 S Ellis Ave, Chicago, Il, 60637",[ 41.78352879 -87.60105753]
"Subsequent to a verbal altercation, one person damaged victim's laptop / Victim declined filing charges",Ex Cleared,Damage to Property,5700 S. Maryland Ave. (CCD),10/14/25 7:44 PM,,2025-10-14 19:46:00-05:00,2025-10-14,Fall,25-01330,"5700 S Maryland Ave, Chicago, Il, 60637",[ 41.7903992  -87.60501721]
Person reported a lost passport,Closed,Lost Property,850 E. 61st St. (UCPD HQ),10/10/25 to 10/13/25 5:00 PM to 3:00 PM,,2025-10-14 13:33:00-05:00,2025-10-14,Fall,25-01329,"850 E 61st St, Chicago, Il, 60637",[ 41.78412446 -87.60566276]
A vehicle struck a water pipe,Closed,Non-Criminal Property Damage,5656 S. Maryland Ave. (Parking Structure),10/14/25 10:20 AM,,2025-10-14 10:20:00-05:00,2025-10-14,Fall,25-01328,"5656 S Maryland Ave, Chicago, Il, 60637",[ 41.7921342  -87.60503297]
Credit card found and turned over to UCPD for safekeeping,Closed,Found Property,850 E. 61st St. (UCPD HQ),10/13/25 2:30 PM,,2025-10-13 16:45:00-05:00,2025-10-13,Fall,25-01327,"850 E 61st St, Chicago, Il, 60637",[ 41.78412446 -87.60566276]
Window smashed in vehicle parked on the street off-campus / Referred to CPD,Referred,Information / Criminal Damage to Vehicle,5611 S. Blackstone Ave. (Public Way),10/11/25 time unknown,,2025-10-13 14:40:00-05:00,2025-10-13,Fall,2025-054894,"5611 S Blackstone Ave, Chicago, Il, 60637",[ 41.7931062  -87.59021563]
iPhone found on UC Shuttle Bus turned over to UCPD for safekeeping,Closed,Found Property,850 E. 61st St. (UCPD HQ),10/13/25 9:37 AM,,2025-10-13 09:37:00-05:00,2025-10-13,Fall,25-01326,"850 E 61st St, Chicago, Il, 60637",[ 41.78412446 -87.60566276]
A 2025 Honda CRV was taken from the street off-campus / Referred to CPD,Referred,Information / Motor Vehicle Theft,1605 E. 50th St. (Public Way),10/12/25 to 10/13/25 8:30 PM to 7:35 AM,,2025-10-13 08:15:00-05:00,2025-10-13,Fall,2025-054825,"1605 E 50th St, Chicago, Il, 60615",[ 41.8042966  -87.58625501]
A victim suffered gunshot wounds on the street off-campus / Suspect was taken into custody by CPD officers / CPD case JJ449689,CPD,Information / Aggravated Battery,5140 S. Hyde Park Blvd. (Public Way),10/13/25 7:55 AM,,2025-10-13 08:03:00-05:00,2025-10-13,Fall,2025-054819,"5140 S Hyde Park Blvd, Chicago, Il, 60615",[ 41.80174014 -87.58494397]
An unknown subject took merchandise from the off-campus store without paying / CPD case JJ449677,CPD,Information / Theft,1346 E. 53rd St. (Target),10/13/25 7:25 AM,,2025-10-13 07:27:00-05:00,2025-10-13,Fall,2025-054812,"1346 E 53rd St, Chicago, Il, 60615",[ 41.79955044 -87.59306282]
UCPD officers arrested a subject for unlawful possession of a handgun,Arrest,Unlawful Possession of a Firearm,5120 S. Harper Ave. (Public Way),10/12/25 10:43 PM,,2025-10-12 22:43:00-05:00,2025-10-12,Fall,25-01325,"5120 S Harper Ave, Chicago, Il, 60615",[ 41.80109184 -87.58918107]
A person in need of medical attention was transported to UCMED by CFD EMS,Closed,Medical Call,1005 E. 60th St. (Burton-Judson RH),10/12/25 7:26 PM,,2025-10-12 19:28:00-05:00,2025-10-12,Fall,25-01324,"1005 E 60th St, Chicago, Il, 60637",[ 41.78587286 -87.60103446]
During the course of a disagreement one person struck the other and fled,Open,Battery,5721 S. Maryland Ave. (Comer Hospital),10/12/25 1:00 PM,,2025-10-12 17:18:00-05:00,2025-10-12,Fall,25-01323,"5721 S Maryland Ave, Chicago, Il, 60637",[ 41.79028249 -87.60486169]
A verbal altercation became physical / Peace restored,Closed,Battery,6300 S. University Ave. (S. Woodlawn Ave. Charter School),10/12/25 5:05 PM,,2025-10-12 17:10:00-05:00,2025-10-12,Fall,25-01322,"6300 S University Ave, Chicago, Il, 60637",[ 41.78045408 -87.59732204]
"Tires slashed, vehicle body keyed while parked on the street",Open,Criminal Damage to Vehicle,5700 S. Drexel Ave. (Public Way),10/11/25  to 10/12/25 11:00 PM to 2:35 PM,,2025-10-12 14:45:00-05:00,2025-10-12,Fall,25-01321,"5700 S Drexel Ave, Chicago, Il, 60637",[ 41.79130835 -87.60381591]
UCPD officers recovered a motorcycle that had been reported stolen A stolen firearm was also recovered at the scene,Closed,Recovered Vehicle,5125 S. Kenwood Ave. (Alley),10/11/25 8:28 PM,,2025-10-11 20:28:00-05:00,2025-10-11,Fall,25-01319,"5125 S Kenwood Ave, Chicago, Il, 60615",[ 41.80201942 -87.59338698]
A parked and secured 2025 Honda SUV taken by unknown person,Open,Motor Vehicle Theft,936 E. 60th St. (Public Way),10/11/25 3:30 PM,,2025-10-11 19:03:00-05:00,2025-10-11,Fall,25-01318,"936 E 60th St, Chicago, Il, 60637",[ 41.78596513 -87.60296103]
A traffic violator was arrested for an active warrant from Cook County Sheriff's Police,Arrest,Warrant Arrest,1623 E. 53rd St. (Public Way),10/11/25 5:30 PM,,2025-10-11 17:30:00-05:00,2025-10-11,Fall,25-01317,"1623 E 53rd St, Chicago, Il, 60615",[ 41.79953486 -87.5853739 ]
A known person spit on another person during the course of a disagreement on the street off-campus / Referred to CPD,Referred,Information / Battery,5415 S. Woodlawn Ave. (Public Way),10/11/25 12:30 AM,,2025-10-11 17:15:00-05:00,2025-10-11,Fall,2025-054458,"5415 S Woodlawn Ave, Chicago, Il, 60615",[ 41.79740279 -87.5965202 ]
"A known person took victim's unsecured, unattended electric bike / Victim chased the suspect and recovered his bike / Suspect fled on foot",Closed,Theft,6031 S. Ellis Ave. (Public Way),10/11/25 2:17 PM,,2025-10-11 14:17:00-05:00,2025-10-11,Fall,25-01320,"6031 S Ellis Ave, Chicago, Il, 60637",[ 41.78535247 -87.60110174]
Credit cards fund and turned over to UCPD for safekeeping,Closed,Found Property,970 E. 58th St. (Bookstore),10/11/25 11:44 AM,,2025-10-11 11:44:00-05:00,2025-10-11,Fall,25-01315,"970 E 58th St, Chicago, Il, 60637",[ 41.78958698 -87.60472689]
An unknown person took merchandise from the off-campus store without paying / Referred to CPD,Referred,Information / Theft,1554 E. 55th St. (Walgreens),10/11/25 10:47 AM,,2025-10-11 10:57:00-05:00,2025-10-11,Fall,2025-054399,"1554 W 55th St, Chicago, Il, 60609",[ 41.79409491 -87.66382574]
Two subjects attempting to steal a catalytic converter from a parked vehicle pointed a handgun at a person on the street off-campus before fleeing / CPD case JJ447601,CPD,Information / Aggravated Assault / Attempted Theft from Motor Vehicle,1435 E. Hyde Park Blvd. (Public Way),10/11/25 6:23 AM,,2025-10-11 06:26:00-05:00,2025-10-11,Fall,2025-054360,"1435 E Hyde Park Blvd, Chicago, Il, 60615",[ 41.80237886 -87.59042841]
A motorist committed several traffic violations and fled from police / Suspect charged with felony,Arrest,Traffic Violation Arrest,5400 S. Kimbark Ave. (Public Way),10/11/25 2:17 AM,,2025-10-11 02:17:00-05:00,2025-10-11,Fall,25-01314,"5400 S Kimbark Ave, Chicago, Il, 60615",[ 41.79795014 -87.59506765]
A person reported losing their phone on a UC Connector Bus,Closed,Lost Property,5850 S. Woodlawn Ave.,10/10/25 5:53 PM,,2025-10-10 17:53:00-05:00,2025-10-10,Fall,25-01313,"5850 S Woodlawn Ave, Chicago, Il, 60637",[ 41.78869292 -87.59647028]
"A patient, fully licensed, had possession of a firearm upon arrival / Weapon secured by UCPD",Closed,Information,5656 S. Maryland Ave. (UCMED),10/10/25 2:33 PM,,2025-10-10 14:33:00-05:00,2025-10-10,Fall,25-01311,"5656 S Maryland Ave, Chicago, Il, 60637",[ 41.7921342  -87.60503297]
Window smashed on truck parked on the street,Open,Criminal Damage to Vehicle,1174 E. 57th St. (Public Way),10/10/25 6:00 AM to 12:30 PM,,2025-10-10 12:35:00-05:00,2025-10-10,Fall,25-01310,"1174 E 57th St, Chicago, Il, 60637",[ 41.79149096 -87.59751046]
A temporary contract employee was escorted off-campus at the request of employer,Closed,Information,5500 S. University Ave. (Campus North RH),10/10/25 12:21 PM,,2025-10-10 12:21:00-05:00,2025-10-10,Fall,25-01309,"5500 S University Ave, Chicago, Il, 60637",[ 41.79501825 -87.5981983 ]
Rideshare driver found jacket in vehicle / Owner contacted,Closed,Found Property,850 E. 61st St. (UCPD HQ),10/10/25 12:00 PM,,2025-10-10 12:15:00-05:00,2025-10-10,Fall,25-01312,"850 E 61st St, Chicago, Il, 60637",[ 41.78412446 -87.60566276]
UCPD officer detained the driver of a vehicle that had been reported stolen by a leasing service / Owner declined to sign charges / Motorist released after being issued traffic citations,Closed,Recovered Vehicle,5100 S. Dorchester Ave. (Public Way),10/10/25 9:19 AM,,2025-10-10 09:19:00-05:00,2025-10-10,Fall,25-01308,"5100 S Dorchester Ave, Chicago, Il, 60615",[ 41.8023602  -87.59192673]
An underage individual became ill after consuming alcoholic beverages and was transported to UCMED by CFD EMS,Referred,Liquor Law Violation,1156 E. 61st St. (S. Woodlawn Ave. RC),10/10/25 2:02 AM,,2025-10-10 02:02:00-05:00,2025-10-10,Fall,25-01307,"1156 E 61st St, Chicago, Il, 60637",[ 41.78420791 -87.5974474 ]
An underage individual became ill after consuming alcoholic beverages and was transported to UCMED by CFD EMS,Referred,Liquor Law Violation,6031 S. Ellis Ave. (Granville-Grossman RH),10/10/25 12:18 AM,,2025-10-10 00:18:00-05:00,2025-10-10,Fall,25-01306,"6031 S Ellis Ave, Chicago, Il, 60637",[ 41.78535247 -87.60110174]
Two students involved in physical altercation / Parents declined charges / Administration to handle discipline,Ex. Cleared,Battery,6300 S. University Ave. (S. Woodlawn Ave. Charter School),10/9/25 4:00 PM,,2025-10-09 16:16:00-05:00,2025-10-09,Fall,25-01305,"6300 S University Ave, Chicago, Il, 60637",[ 41.78045408 -87.59732204]
Apple AirPods taken by unknown person,Open,Theft,5706 S. University Ave. (Reynolds Club),10/3/25 3:00 PM to 5:30 PM,,2025-10-09 11:02:00-05:00,2025-10-09,Fall,25-01304,"5706 S University Ave, Chicago, Il, 60637",[ 41.79126654 -87.59814716]
One vehicle struck another vehicle in traffic and drove off from the scene,Open,Traffic Crash / Minor Personal Injury / Hit and Run,6100 S. Drexel Ave. (Public Way),10/9/25 7:23 AM,,2025-10-09 07:25:00-05:00,2025-10-09,Fall,25-01303,"6100 S Drexel Ave, Chicago, Il, 60637",[ 41.78311745 -87.60444617]
A person in need of medical attention was transported to UCMED by CFD EMS,Closed,Medical Call,1414 E. 59th St. (Public Way),10/9/25 4:01 AM,,2025-10-09 04:01:00-05:00,2025-10-09,Fall,25-01302,"1414 E 59th St, Chicago, Il, 60637",[ 41.78791518 -87.59109314]
A UCPD officer arrested a motorist for DUI,Arrest,DUI,1100 E. 53rd St. (Public Way),10/9/25 3:07 AM,,2025-10-09 03:07:00-05:00,2025-10-09,Fall,25-01301,"1100 E 53rd St, Chicago, Il, 60615",[ 41.79948064 -87.59966545]
An underage person became ill after consuming alcoholic beverages / Refused CFD transport,Referred,Liquor Law Violation,5500 S. University Ave. (CNRH),10/9/25 1:32 AM,,2025-10-09 01:32:00-05:00,2025-10-09,Fall,25-01300,"5500 S University Ave, Chicago, Il, 60637",[ 41.79501825 -87.5981983 ]
Suspicious activity documented,Closed,Suspicious Person,5717 S. Woodlawn Ave. (Hillel House),10/8/25 12:30 PM to 3:00 PM,,2025-10-08 21:01:00-05:00,2025-10-08,Fall,25-01299,"5717 S Woodlawn Ave, Chicago, Il, 60637",[ 41.7909689 -87.5963702]
A patient arrived with a firearm / Patient was licensed and UCPD secured the firearm for safekeeping,Closed,Information,5721 S. Maryland Ave. (Comer Hospital),10/8/25 7:24 PM,,2025-10-08 19:24:00-05:00,2025-10-08,Fall,25-01298,"5721 S Maryland Ave, Chicago, Il, 60637",[ 41.79028249 -87.60486169]
A verbal disagreement turned physical and one party struck the other / Victim declined to prosecute / Peace restored,Ex. Cleared,Battery,5700 S. Maryland Ave. (CCD),10/8/25 2:28 PM,,2025-10-08 14:32:00-05:00,2025-10-08,Fall,25-01297,"5700 S Maryland Ave, Chicago, Il, 60637",[ 41.7903992  -87.60501721]
Cell phone found in a ride share vehicle was turned over to UCPD for safekeeping,Closed,Found Property,850 E. 61st St. (UCPD HQ),10/8/25 1:11 PM,,2025-10-08 13:33:00-05:00,2025-10-08,Fall,25-01296,"850 E 61st St, Chicago, Il, 60637",[ 41.78412446 -87.60566276]
Verbal domestic argument documented,Closed,Information,5721 S. Maryland Ave. (Public Way),10/8/25 10:00 AM,,2025-10-08 10:12:00-05:00,2025-10-08,Fall,25-01295,"5721 S Maryland Ave, Chicago, Il, 60637",[ 41.79028249 -87.60486169]
A 2008 Honda was taken from the street off-campus,Closed,Motor Vehicle Theft,5330 S. Kimbark Ave. (Public Way),10/8/25 6:35 AM,,2025-10-08 06:38:00-05:00,2025-10-08,Fall,25-01331,"5330 S Kimbark Ave, Chicago, Il, 60615",[ 41.79874686 -87.59508475]
UCPD officers located and detained a suspect wanted by CPD / Subject turned over to and arrested by CPD,CPD,Assist Other Agency,5525 S. Cottage Grove Ave. (Public Way),10/8/25 3:25 AM,,2025-10-08 03:27:00-05:00,2025-10-08,Fall,25-01294,"5525 S Cottage Grove Ave, Chicago, Il, 60637",[ 41.79449488 -87.60614011]
A person was entrapped in an elevator / CFD arrived and freed the occupant,Closed,Information,1156 E. 61st St. (S. Woodlawn Ave. R.C.),10/8/25 12:03 AM,,2025-10-08 00:05:00-05:00,2025-10-08,Fall,25-01292,"1156 E 61st St, Chicago, Il, 60637",[ 41.78420791 -87.5974474 ]
Small amount of Allyl Methacrylate spilled from a syringe into person's eye / Self transported to UCMED / Research Safety on Scene,Closed,Chemical Spill / Medical Call,5735 S. Ellis Ave. (Searle Lab),10/7/25 10:00 PM,,2025-10-07 22:01:00-05:00,2025-10-07,Fall,25-01291,"5735 S Ellis Ave, Chicago, Il, 60637",[ 41.79073052 -87.60120831]
Lost wallet reported,Closed,Lost Property,5700 S. Maryland Ave. (CCD),10/7/25 6:35 PM to 6:40 PM,,2025-10-07 18:54:00-05:00,2025-10-07,Fall,25-01290,"5700 S Maryland Ave, Chicago, Il, 60637",[ 41.7903992  -87.60501721]
Person misplaced bicycle somewhere on campus / Unsure of location,Closed,Lost Property,1100 E. 57th St. (Regenstein Library),10/7/25 3:00 PM to 6:10 PM,,2025-10-07 18:21:00-05:00,2025-10-07,Fall,25-01289,"1100 E 57th St, Chicago, Il, 60637",[ 41.79148537 -87.59815254]
An unauthorized person was officially notified they were trespassing,Closed,Information,5807 S. Woodlawn Ave. (Booth School),10/7/25 12:14 PM,Damage to UC Vehicle,2025-10-07 12:15:00-05:00,2025-10-07,Fall,25-01288,"5807 S Woodlawn Ave, Chicago, Il, 60637",[ 41.78945965 -87.5963329 ]
A subject struck a UCM staff member and was arrested by UCPD / Charged with felony,Arrest,Battery,5656 S. Maryland Ave. (UCMED,10/7/25 8:42 AM,,2025-10-07 08:42:00-05:00,2025-10-07,Fall,25-01287,"5656 S Maryland Ave, Chicago, Il, 60637",[ 41.7921342  -87.60503297]
A subject spit on a UCM staff member / Victim declined to prosecute,Ex. Cleared,Battery,5656 S. Maryland Ave. (UCMED,10/7/25 6:45 AM,,2025-10-07 06:45:00-05:00,2025-10-07,Fall,25-01286,"5656 S Maryland Ave, Chicago, Il, 60637",[ 41.7921342  -87.60503297]
Suspect arrested for striking another person off-campus / Suspect resisted arrest by UCPD officer,Arrest,Battery,1554 E. 55th St. (Parking Lot),10/7/25 1:34 AM,,2025-10-07 01:34:00-05:00,2025-10-07,Fall,25-01285,"1554 W 55th St, Chicago, Il, 60609",[ 41.79409491 -87.66382574]
A threat to a patient by a known person was documented,Closed,Information,5721 S. Maryland Ave. (Comer Hospital),10/6/25 11:50 PM,,2025-10-07 00:29:00-05:00,2025-10-07,Fall,25-01284,"5721 S Maryland Ave, Chicago, Il, 60637",[ 41.79028249 -87.60486169]
An underage individual became ill after consuming alcoholic beverages and was transported to UCMED by CFD EMS,Referred,Liquor Law Violation,1156 E. 61st St. (S. Woodlawn Ave. R.C.),10/6/25 11:06 PM,,2025-10-06 23:09:00-05:00,2025-10-06,Fall,25-01283,"1156 E 61st St, Chicago, Il, 60637",[ 41.78420791 -87.5974474 ]
Secured electric bicycle taken from bike rack,Open,Theft,1111 E. 60th St. (Law School Bike Rack),10/3/25 to 10/6/25 6:00 PM to 8:30 AM,,2025-10-06 20:59:00-05:00,2025-10-06,Fall,25-01276,"1111 E 60th St, Chicago, Il, 60637",[ 41.78589703 -87.59887484]
A secured electric scooter taken from bike rack,Open,Theft,1100 E. 57th St. (Regenstein Library),10/5/25 5:25 PM to 8:00 PM,,2025-10-06 16:50:00-05:00,2025-10-06,Fall,25-01282,"1100 E 57th St, Chicago, Il, 60637",[ 41.79148537 -87.59815254]
An unknown subject took a secured electric scooter from the bike rack,Open,Theft,924 E. 57th St. (BSLC),10/6/25 1:22 PM,,2025-10-06 13:24:00-05:00,2025-10-06,Fall,25-01281,"924 E 57th St, Chicago, Il, 60637",[ 41.79143109 -87.60311062]
Fire alarm triggered due to faulty fire sprinkler in ceiling,Closed,Fire Alarm,1155 E. 57th St. (Quad Club),10/6/25 1:02 PM,,2025-10-06 13:02:00-05:00,2025-10-06,Fall,25-01280,"1155 E 57th St, Chicago, Il, 60637",[ 41.79137186 -87.59784005]
Fire alarm pulled by staff member / CFS responded / Smoke in the building due to a ceiling fan malfunction,Closed,Fire Alarm,5721 S. Maryland Ave. (Comer Hospital),10/6/25 11:00 AM,,2025-10-06 11:19:00-05:00,2025-10-06,Fall,25-01279,"5721 S Maryland Ave, Chicago, Il, 60637",[ 41.79028249 -87.60486169]
A person took merchandise from the off-campus store without paying / Suspect located and arrested by UCPD officers,Arrest,Theft,1554 E. 55th St. (Walgreens),10/6/25 10:44 AM,,2025-10-06 10:45:00-05:00,2025-10-06,Fall,25-01278,"1554 W 55th St, Chicago, Il, 60609",[ 41.79409491 -87.66382574]
Window shattered and construction equipment taken from van parked on the street,Open,Theft,1131 E. 57th St. (Public Way),10/6/25 6:00 AM to 10:35 AM,,2025-10-06 10:39:00-05:00,2025-10-06,Fall,25-01277,"1131 E 57th St, Chicago, Il, 60637",[ 41.79136831 -87.59832779]
A sick person was transported to UCMED by CFD EMS,Closed,Medical Call,6031 S. Ellis Ave. (Granville-Grossman RH),10/6/25 8:29 AM,,2025-10-06 08:29:00-05:00,2025-10-06,Fall,25-01275,"6031 S Ellis Ave, Chicago, Il, 60637",[ 41.78535247 -87.60110174]
A subject took a parcel from the front porch of an off-campus residence and was arrested by UCPD officer / Suspect also had an active warrant,Arrest,Theft,S. Drexel Ave. between E. 50th St. and E. 51st St. (Residential Porch),10/5/25 8:38 PM,,2025-10-05 20:44:00-05:00,2025-10-05,Fall,25-01274,"5020 South Drexel Avenue, Chicago, Il 60615",[ 41.802097  -87.6039139]
A subject unlawfully entered a vehicle parked on the street off-campus / Suspect detained by UCPD officers / Owner declined to press charges,Ex. Cleared,Trespass to Vehicle,5300 S. Kenwood Ave. (Public Way),10/5/25 7:25 PM,,2025-10-05 19:25:00-05:00,2025-10-05,Fall,25-01273,"5300 South Kenwood Avenue, Chicago, Il 60615",[ 41.799484  -87.5925496]
A person in need of medical attention transported to UCMED by CFD EMS,Closed,Medical Call,5500 S. University Ave. (Campus North R.H.),10/5/25 12:33 PM,,2025-10-05 12:33:00-05:00,2025-10-05,Fall,25-01272,"5500 S University Ave, Chicago, Il, 60637",[ 41.79501825 -87.5981983 ]
A person in need of medical attention transported to UCMED,Closed,Medical Call,5630 S. University Ave. (Max Palevsky RH),10/5/25 2:40 AM,,2025-10-05 02:40:00-05:00,2025-10-05,Fall,25-01271,"5630 S University Ave, Chicago, Il, 60637",[ 41.79266737 -87.59818173]
A sick person was transported to UCMED by CFD EMS,Closed,Medical Call,5431 S. Woodlawn Ave. (Public Way),10/5/25 12:58 AM,,2025-10-05 00:59:00-05:00,2025-10-05,Fall,25-01270,"5431 S Woodlawn Ave, Chicago, Il, 60615",[ 41.79694366 -87.59651036]
Unknown subject took and bag from rear porch of off-campus building / CPD case,CPD,Information / Theft,S. Kimbark Ave. between E. 53rd St. and E. 54th St.,10/4/25 5:00 PM to 6:00 PM,,2025-10-04 23:14:00-05:00,2025-10-04,Fall,2025-052755,"5320 South Kimbark Avenue, Chicago, Il 60615-6160",[ 41.7988018 -87.5953313]
A person walking on the sidewalk off-campus was struck on the eye by a paintball fired from a passing vehicle / Victim transported to UCMED by CFD EMS / CPD case,CPD,Information / Aggravated Battery,5500 S. Lake Park Ave. (Public Way),10/4/25 10:20 PM,,2025-10-04 22:23:00-05:00,2025-10-04,Fall,2025-052747,"5500 S Lake Park Ave, Chicago, Il, 60637",[ 41.79498333 -87.5876429 ]
"A vehicle was reported stolen from 5460 S. Ingleside and later recovered, unoccupied, by UCPD at 5312 S. Maryland",Closed,Motor Vehicle Theft / Recovery,5462 S. Ingleside Ave. (Public Way),10/4/25 6:30 to 7:00 PM,,2025-10-04 19:06:00-05:00,2025-10-04,Fall,25-01269,"5462 S Ingleside Ave, Chicago, Il, 60615",[ 41.79615363 -87.60282899]
A person in need of medical attention was transported to UCMED by CFD EMS,Closed,Medical Call,1156 E. 61st St. (S. Woodlawn Ave. R.C.),10/4/25 6:05 PM,,2025-10-04 18:05:00-05:00,2025-10-04,Fall,25-01268,"1156 E 61st St, Chicago, Il, 60637",[ 41.78420791 -87.5974474 ]
Unknown subject took bicycle from off-campus garage / Referred to CPD,Referred,Information / Theft,S. Blackstone Ave. between E. 56th St. and E. 57th St.,10/4/25 1:40 AM,,2025-10-04 17:19:00-05:00,2025-10-04,Fall,2025-052684,"5620 South Blackstone Avenue, Chicago, Il 60637-1828",[ 41.7926306 -87.5906713]
Unknown subject broke into a vehicle parked on the street off-campus / Referred to CPD,Referred,Information / Criminal Damage to Vehicle,4937 S. Woodlawn Ave. (Public Way),10/3/25 to 10/4/25 9:00 AM to 10:00 AM,,2025-10-04 14:10:00-05:00,2025-10-04,Fall,2025-052647,"4937 S Woodlawn Ave, Chicago, Il, 60615",[ 41.80531785 -87.59667811]
A motorist was slightly injured when another vehicle struck their vehicle in traffic and fled the scene,Open,Traffic Crash / Personal Injury / Hit and Run,850 E. 61st St. (Public Way),10/4/25 12:15 PM,,2025-10-04 13:49:00-05:00,2025-10-04,Fall,25-01267,"850 E 61st St, Chicago, Il, 60637",[ 41.78412446 -87.60566276]
"A vehicle was stolen from 5032 S. East End and later recovered, unattended, by UCPD",Open,Motor Vehicle Theft / Recovery,1438 E. 59th St. (Public Way),10/3/25 to 10/4/25 11:00 PM to 8:45 AM,,2025-10-04 10:02:00-05:00,2025-10-04,Fall,25-01265,"1438 E 59th St, Chicago, Il, 60637",[ 41.78792183 -87.590495  ]
UCPD officers assisted CPD by attempting to detain subjects wanted for criminal damage to a vehicle / CPD case JJ397559,CPD,Assist Other Agency,5300 S. Blackstone Ave. (Public Way),10/4/25 9:18 AM,,2025-10-04 09:18:00-05:00,2025-10-04,Fall,25-01264,"5300 S Blackstone Ave, Chicago, Il, 60615",[ 41.79947058 -87.59051287]
A person became ill after consuming alcoholic beverages and was transported to UCMED by CFD EMS,Referred,Liquor Law Violation,5500 S. University Ave. (Campus North RH),10/4/25 4:00 AM,,2025-10-04 04:03:00-05:00,2025-10-04,Fall,25-01263,"5500 S University Ave, Chicago, Il, 60637",[ 41.79501825 -87.5981983 ]
A person in need of medical attention was transported to UCMED by CFD EMS,Closed,Medical Call,1330 E. 53rd St.,10/4/25 1:18 AM,,2025-10-04 01:18:00-05:00,2025-10-04,Fall,25-01262,"1330 E 53rd St, Chicago, Il, 60615",[ 41.7995424  -87.59371997]
Cell phone found and returned to owner,Closed,Found Property,1520 E. 57th St. (Metra),10/3/25 11:57 PM,,2025-10-03 23:57:00-05:00,2025-10-03,Fall,25-01261,"1520 E 57th St, Chicago, Il, 60637",[ 41.79160345 -87.58822006]
Secured bicycle taken from bike rack,Open,Theft,1100 E. 57th St. (Regenstein Bike Rack),10/3/25 11:00 AM to 8:00 PM,,2025-10-03 21:41:00-05:00,2025-10-03,Fall,25-01259,"1100 E 57th St, Chicago, Il, 60637",[ 41.79148537 -87.59815254]
Ventra card found and turned over to UCPD for safekeeping,Closed,Found Property,5500 S. Hyde Park Blvd. (Public Way),10/3/25 8:30 PM,,2025-10-03 20:30:00-05:00,2025-10-03,Fall,25-01258,"5500 S Hyde Park Blvd, Chicago, Il, 60637",[ 41.79516893 -87.58402435]
Secured bicycle taken from bike rack,Open,Theft,5800 S. Greenwood Ave. (Main Quad Bike Rack),10/3/25 3:00 PM to 7:00 PM,,2025-10-03 19:47:00-05:00,2025-10-03,Fall,25-01257,"5800 South Greenwood Avenue, Chicago, Il 60637",[ 41.794205  -87.5996903]
iPad taken from victim's apartment off-campus / Referred to CPD,Referred,Information / Theft,5200 S. Blackstone Ave.,10/3/25 3:00 PM to 5:00 PM,,2025-10-03 19:04:00-05:00,2025-10-03,Fall,2025-052436,"5200 S Blackstone Ave, Chicago, Il, 60615",[ 41.80093758 -87.59054887]
A vehicle parked on the street was struck by another vehicle that fled the scene,Open,Traffic Crash / Property Damage / Hit and Run,1435 E. Midway Plaisance (Public Way),10/3/25 11:20 AM to 3:15 PM,,2025-10-03 15:25:00-05:00,2025-10-03,Fall,25-01256,"1435 East Midway Plaisance, Chicago, Il 60637",[ 41.7872049 -87.5990833]
Secured electric scooter taken from bike rack,Open,Theft,5500 S. University Ave. (Campus North RH Bike Rack),10/1/25 to 10/3/25 8:30 PM to 9:00 AM,,2025-10-03 13:38:00-05:00,2025-10-03,Fall,25-01254,"5500 S University Ave, Chicago, Il, 60637",[ 41.79501825 -87.5981983 ]
An unknown subject was believed to take merchandise from the off-campus store / UCPD officer detained a suspect who was later released,Closed,Information,1554 E. 55th St. (Walgreens),10/3/25 12:59 PM,Credit Card Fraud,2025-10-03 12:59:00-05:00,2025-10-03,Fall,25-01255,"1554 W 55th St, Chicago, Il, 60609",[ 41.79409491 -87.66382574]
2015 Hyundai Sonata secured and parked on the street was taken by an unknown subject,Open,Motor Vehicle Theft,935 E. 60th St. (Public Way),10/3/25 12:52 PM,,2025-10-03 12:52:00-05:00,2025-10-03,Fall,25-01253,"935 E 60th St, Chicago, Il, 60637",[ 41.78584846 -87.60303291]
A person injured his ankle playing soccer / Transported to student Health Center by UCPD officer,Closed,Injured Person,6034 S. Kimbark Ave. (South Campus Field),10/2/25 10:30 PM,,2025-10-03 11:00:00-05:00,2025-10-03,Fall,25-01252,"6034 South Kimbark Avenue, Chicago, Il 60637",[ 41.7846346 -87.5954901]
A person found a wallet and turned it over to UCPD / UCPD located owner and returned the wallet,Closed,Found Property,5400 S. Ellis Ave. (Coleman Park),10/3/25 7:22 AM,,2025-10-03 07:22:00-05:00,2025-10-03,Fall,2025-052306,"5400 S Ellis Ave, Chicago, Il, 60615",[ 41.7978782  -87.60134522]
An underage person became il after consuming alcoholic beverages / Transported to UCMED by CFD EMS,Referred,Liquor Law Violation,1005 E. 60th St. (Burton-Judson RH),10/3/25 12:41 AM,,2025-10-03 00:41:00-05:00,2025-10-03,Fall,25-01251,"1005 E 60th St, Chicago, Il, 60637",[ 41.78587286 -87.60103446]
"UCPD officer arrested a motorist for multiple traffic violations, plus fleeing and eluding police / Felony charges applied",Arrest,Traffic Violation Arrest,5900 S. Cottage Grove Ave. (Public Way),10/3/25 12:00 AM,,2025-10-03 00:02:00-05:00,2025-10-03,Fall,25-01250,"5900 S Cottage Grove Ave, Chicago, Il, 60637",[ 41.78581946 -87.6061124 ]
"Apple watch taken from unattended, unsecured gym bag",Open,Theft,5530 S. Ellis Ave. (Ratner A.C.),10/2/25 8:00 PM to 9:00 PM,,2025-10-02 22:23:00-05:00,2025-10-02,Fall,25-01249,"5530 S Ellis Ave, Chicago, Il, 60637",[ 41.79444356 -87.60144801]
Cell phone lost in Uber vehicle,Closed,Lost Property,1156 E. 61st St. (Public Way),10/2/25 12:30 PM,,2025-10-02 20:54:00-05:00,2025-10-02,Fall,25-01248,"1156 E 61st St, Chicago, Il, 60637",[ 41.78420791 -87.5974474 ]
A plastic replica handgun was found in bushes and turned over to UCPD,Closed,Found Property,5247 S. University Ave.,10/2/25 5:47 PM,,2025-10-02 17:47:00-05:00,2025-10-02,Fall,25-01247,"5247 S University Ave, Chicago, Il, 60615",[ 41.80021516 -87.59811774]
A secured electric scooter was taken from the bike rack,Open,Theft,5747 S. Ellis Ave. (Jones Lab Bike Rack),10/2/25 12:20 PM to 5:00 PM,,2025-10-02 17:04:00-05:00,2025-10-02,Fall,25-01246,"5747 S Ellis Ave, Chicago, Il, 60637",[ 41.79051653 -87.60120377]
A backpack was found and inventoried at UCPD for safekeeping,Closed,Found Property,1554 E. 55th St. (Walgreens),10/2/25 2:09 PM,,2025-10-02 14:09:00-05:00,2025-10-02,Fall,25-01245,"1554 W 55th St, Chicago, Il, 60609",[ 41.79409491 -87.66382574]
An unknown subject took merchandise from the off-campus store without paying / Referred to CPD,Referred,Information / Theft,1554 E. 55th St. (Walgreens),10/2/25 1:50 PM,,2025-10-02 13:53:00-05:00,2025-10-02,Fall,2025-052120,"1554 W 55th St, Chicago, Il, 60609",[ 41.79409491 -87.66382574]
A person tripped and fell going down exterior stairs of the building / Transported to UCMED by CFD EMS,Closed,Accidental Injury,1155 E. 60th St. (IMSI),10/2/25 12:05 PM,,2025-10-02 12:06:00-05:00,2025-10-02,Fall,25-01243,"1155 E 60th St, Chicago, Il, 60637",[ 41.78590886 -87.59786693]
Rental lease fraud reported / Referred to CPD,Referred,Information / Deceptive Practice / Fraud,850 E. 61st St. (UCPD HQ),9/3/25 12:05 PM,,2025-10-02 10:14:00-05:00,2025-10-02,Fall,2025-052084,"850 E 61st St, Chicago, Il, 60637",[ 41.78412446 -87.60566276]
A licensed patient arrived with a firearm in their backpack / Weapon held by UCPD for safekeeping,Closed,Information,5656 S. Maryland Ave. (UCMED),10/2/25 8:20 AM,,2025-10-02 08:20:00-05:00,2025-10-02,Fall,25-01241,"5656 S Maryland Ave, Chicago, Il, 60637",[ 41.7921342  -87.60503297]
A person was transported to UCMED for evaluation,Closed,Medical Transport,5458 S. University Ave. (Public Way),10/2/25 7:56 AM,,2025-10-02 07:57:00-05:00,2025-10-02,Fall,25-01242,"5458 S University Ave, Chicago, Il, 60615",[ 41.79712425 -87.59820265]
An unknown subject entered an off-campus residence and took property / Suspect fled when confronted by resident / CPD case JJ436381,CPD,Information / Burglary,E. 56th St. between S. Blackstone Ave. and S. Harper Ave.,10/2/25 5:00 AM,,2025-10-02 05:19:00-05:00,2025-10-02,Fall,2025-052046,"1447 E 56th St, Chicago, Il 60637",[ 41.7931689 -87.5898003]
A disorderly person was causing a disturbance / Peace restored,Closed,Information,5656 S. Maryland Ave. (UCMED),10/2/25 12:55 AM,Armed Robbery,2025-10-02 00:56:00-05:00,2025-10-02,Fall,25-01240,"5656 S Maryland Ave, Chicago, Il, 60637",[ 41.7921342  -87.60503297]
Street stop documented,Closed,Information,5200 S. University Ave. (Public Way),10/1/25 11:52 PM,,2025-10-01 23:52:00-05:00,2025-10-01,Fall,25-01239,"5200 S University Ave, Chicago, Il, 60615",[ 41.80084822 -87.59828525]
"5-6 suspects, one armed with a handgun, took property from a person walking on the sidewalk off-campus / CPD case",CPD,Information / Armed Robbery,5437 S. Greenwood Ave. (Public Way),10/1/25 10:05 PM,,2025-10-01 22:16:00-05:00,2025-10-01,Fall,2025-051976,"5437 S Greenwood Ave, Chicago, Il, 60615",[ 41.79748713 -87.59962169]
Three unknown suspects forcibly took property from a victim walking on the sidewalk off-campus before fleeing on foot / CPD case JJ436001,CPD,Information / Robbery,5213 S. Dorchester Ave. (Public Way),10/1/25 5:50 PM,,2025-10-01 18:00:00-05:00,2025-10-01,Fall,2025-051909,"5213 S Dorchester Ave, Chicago, Il, 60615",[ 41.8007559  -87.59173904]
Credit and debit cards found on the sidewalk were turned over to UCPD for safekeeping,Closed,Found Property,1124 E. 53rd St. (Public Way),10/1/25 9:40 AM,,2025-10-01 17:40:00-05:00,2025-10-01,Fall,25-01238,"1124 E 53rd St, Chicago, Il, 60615",[ 41.79948745 -87.59939285]
An unknown subject inappropriately touched a victim while seated on a CTA bus / CPD case JJ435956,CPD,Information / Sexual Abuse,1128 E. 55th St. (CTA Bus),10/1/25 12:00 AM,,2025-10-01 15:30:00-05:00,2025-10-01,Fall,2025-051889,"1128 E 55th St, Chicago, Il, 60615",[ 41.79510108 -87.59875568]
Girlfriend slapped and used pepper spray on her boyfriend / Suspect located and arrested by UCPD,Arrest,Domestic Battery,5238 S. Harper Ave. (Harper Theater),10/1/25 3:15 PM,,2025-10-01 15:17:00-05:00,2025-10-01,Fall,25-01237,"5238 S Harper Ave, Chicago, Il, 60615",[ 41.80014806 -87.58917502]
A subject verbally threatened a UCM staff member,Open,Assault,5700 S. Maryland Ave. (CCD),10/1/25 2:40 PM,,2025-10-01 14:55:00-05:00,2025-10-01,Fall,25-01236,"5700 S Maryland Ave, Chicago, Il, 60637",[ 41.7903992  -87.60501721]
Secured electric scooter taken from building handrail,Open,Theft,1118 E. 58th St. (Eckhart Hall),10/1/25 9:20 AM to 12:30 PM,,2025-10-01 13:48:00-05:00,2025-10-01,Fall,25-01235,"1118 E 58th St, Chicago, Il, 60637",[ 41.78967746 -87.59703754]
Electric scooter secured to city street pole taken,Open,Theft,1127 E. 59th St. (Public Way),10/1/25 9:25 AM to 10:25 AM,,2025-10-01 10:43:00-05:00,2025-10-01,Fall,25-01233,"1127 W 59th St, Chicago, Il, 60621",[ 41.78685281 -87.65290792]
An unknown subject took merchandise from the off-campus store without paying / Referred to CPD,Referred,Information / Theft,1554 E. 55th St. (Walgreens),10/1/25 8:35 AM,,2025-10-01 08:37:00-05:00,2025-10-01,Fall,2025-051820,"1554 W 55th St, Chicago, Il, 60609",[ 41.79409491 -87.66382574]
A person was transported to UCMED by CFD EMS for evaluation,Closed,Medical Transport,5100 S. Dorchester Ave. (Public Way),9/30/25 10:22 PM,,2025-09-30 22:22:00-05:00,2025-09-30,Fall,25-01231,"5100 S Dorchester Ave, Chicago, Il, 60615",[ 41.8023602  -87.59192673]
A juvenile reported missing from Indiana was found and turned over to DCFS and family,Closed,Found Person,6200 S. Kimbark Ave. (Huckleberry Park),9/30/25 7:49 PM,,2025-09-30 19:52:00-05:00,2025-09-30,Fall,25-01232,"6200 S Kimbark Ave, Chicago, Il, 60637",[ 41.78229881 -87.59476116]
An unknown suspect took victim's rented Divvy bike that was left unsecured and attended off-campus / Referred to CPD,Referred,Information / Theft,5459 S. Blackstone Ave. (Public Way),9/30/25 3:15 PM,,2025-09-30 15:25:00-05:00,2025-09-30,Fall,2025-051663,"5459 S Blackstone Ave, Chicago, Il, 60615",[ 41.79641227 -87.59028886]
A subject took merchandise from the off-campus store without paying / Suspect located and arrested by UCPD officer,Arrest,Theft,1554 E. 55th St. (Walgreens),9/30/25 11:47 AM,,2025-09-30 11:48:00-05:00,2025-09-30,Fall,25-01230,"1554 W 55th St, Chicago, Il, 60609",[ 41.79409491 -87.66382574]
An unauthorized person ignored previous warnings and was arrested for trespass,Arrest,Trespass to Property,6330 S. Stony Island Ave. (YMCA),9/30/25 9:59 AM,,2025-09-30 10:01:00-05:00,2025-09-30,Fall,25-01229,"6330 S Stony Island Ave, Chicago, Il, 60637",[ 41.78002971 -87.58652776]
Domestic dispute documented / Peace restored,Closed,Information,950 E. 61st St. (UCPD HQ),9/29/25 10:50 PM,Attempted Aggravated Vehicular Hijacking,2025-09-29 22:50:00-05:00,2025-09-29,Fall,25-01228,"950 E 61st St, Chicago, Il, 60637",[ 41.78415146 -87.60269093]
Loading dock gate closed and struck vehicle causing damage,Closed,Non-Criminal Damage to Vehicle,5830 S. Ellis Ave. (Loading Dock),9/29/25 4:05 PM,,2025-09-29 16:46:00-05:00,2025-09-29,Fall,25-01227,"5830 S Ellis Ave, Chicago, Il, 60637",[ 41.78901695 -87.60132816]
Victim's boyfriend pushed victim knocking her to the floor before leaving the scene,Open,Domestic Battery,5721 S. Maryland Ave. (Comer Hospital),9/29/25 2:47 PM,,2025-09-29 14:48:00-05:00,2025-09-29,Fall,25-01226,"5721 S Maryland Ave, Chicago, Il, 60637",[ 41.79028249 -87.60486169]
Person reported lost ID card,Closed,Lost Property,5505 S. Ellis Ave. (Parking Structure),9/26/25 2:30 PM,,2025-09-29 12:44:00-05:00,2025-09-29,Fall,25-01225,"5505 S Ellis Ave, Chicago, Il, 60637",[ 41.79483054 -87.60129259]
